,Sentence,Class
6360,want busy moving house got ill im still ill,0
6361,love you so much beleve that he wll follow please follow me please justn,0
6362,would terrible,0
6363,im tired af need ignore bc schoolwork,0
6364,want taco,0
6365,whats phoebe name shot cant find,0
6366,love you so much beleve that he wll follow please follow me please justn,0
6367,im sorry block,0
6368,yes dont last year cycle massive puddle see huge pothole get stuck fall water,0
6369,of those time it been out of my control and havent been able to miss,0
6370,love you so much beleve that he wll follow please follow me please justn,0
6371,havent followed yet,0
6372,infinite im sorry cant stream,0
6373,im sorry,0
6374,how turn notification ive past day,0
6375,hi robyn really sorry one necklace rachel,0
6376,ang cold,0
6377,amazing set question bhai keep missing ramzan,0
6378,no yet hopefully soon finger crosssed are coming,0
6379,need investigate,0
6380,one gift feeling jealous,0
6381,no friday night live sth au so purchased digital pas still wait see delay,0
6382,oh dear xx,0
6383,movie essentially cut beginning book plot,0
6384,tonight got photoshoooot,0
6385,austin mahone all ever need,0
6386,oh well wouldnt hurt visit doctor,0
6387,andaming memorization,0
6388,is anyone,0
6389,cotton candy favourite time stock,0
6390,cant sleep,0
6391,my poor baby sick and doesnt concept swallowing snot choke,0
6392,feeling colzdxioam,0
6393,guy add kik taknottem coegplpegr,0
6394,aw man get better soon,0
6395,maybe im ill listen like ill stay old btob song,0
6396,god please help,0
6397,really miss,0
6398,keep saying busy mine,0
6399,going moment percentage ohh please,0
6400,nobody go,0
6401,snapchat shoshannavassil cocowycueaa,0
6402,wish going taylor swift,0
6403,flat love make puke,0
6404,heck dont follow,0
6405,it would ice cream without ice,0
6406,too many people asking im back la,0
6407,look painful,0
6408,snapchat guy sexyjane corznnslxq,0
6409,delph minute debut,0
6410,lart rt,0
6411,might sew and know someone took orange chair,0
6412,already left,0
6413,didnt meet skyfall premiere age ago though he yummy like cake,0
6414,woke pee sun coming cant go back sleep,0
6415,im manteca im visiting dad,0
6416,asked shed probably stab found speed massage chair shiatsu setting heat le risk,0
6417,edward hopper coqxgzjjnxf,0
6418,eyyah man utd born best,0
6419,booked trip crisis,0
6420,missed goal real,0
6421,im really sad live photo set cart shop logged,0
6422,aaaaaaaaaaaaa need decide waifu like tomorrow,0
6423,happen babe,0
6424,playing give your heart break memory the breakup episode love song tho,0
6425,cold never bothered anyway,0
6426,also dream joe want hug tell cute,0
6427,im like major fan bias syndrome get shy around bias,0
6428,my stream is so pixelated,0
6429,when you actually decide to come see me ive tried to give it to you like time,0
6430,weh thought sa may bank,0
6431,wanted get isnt uber ice cream area,0
6432,maymay if ever make plan do it in advance huhu need like week allowance na magpaalam,0
6433,tf cant find subtitle oitnb need understand chang backstory,0
6434,jeremy kyle close home morning,0
6435,going home,0
6436,miss cofsryukgt,0
6437,miss boy together mean,0
6438,when bus late time get food work,0
6439,gim enjoy meal baby,0
6440,realised month clean wow think thats neat,0
6441,wru scissors,0
6442,dear plz dont post creation public without permission amtired telling every,0
6443,dont app,0
6444,bank bank tut,0
6445,think messed ankle,0
6446,trop tard,0
6447,managed month account tax credit deadline st only get child tax credit cut oct,0
6448,gave away last night didnt hear anybody,0
6449,hear many frog morning,0
6450,im cry right baby,0
6451,online please,0
6452,nothing shepherd bush either want ice cream,0
6453,friend whatsoever lol oh well,0
6454,premiun feature making,0
6455,almost done sa lahat ng araw bakit naging saturday pa final ko,0
6456,gyu cute hurt ok coyckcewj,0
6457,lmfaoooo coguqjhpmnx,0
6458,ive awake since like three,0
6459,well say deleted twitter app week ago literally downloaded sorry,0
6460,acc cant look,0
6461,still havent,0
6462,come online babe,0
6463,aw hoping,0
6464,wish friend played league,0
6465,literally feel like eating good fruit im,0
6466,cant afford please give first full mashup pack please,0
6467,gon na watch eu lcs hour help need sleep,0
6468,hope find new home,0
6469,real talk account match,0
6470,typo ye,0
6471,dont come italy,0
6472,rly wan na spend christmas relative yr,0
6473,really first ever edit haha,0
6474,just luck when move sydney everyone decides dont want go hahaha,0
6475,dont get mb need cut perf dont cut programme,0
6476,just like min ago bought dinner,0
6477,ur actually watching smh jk omfg im hyper,0
6478,tired grumpy today hate missing exercise make feel much better can go combat holiday,0
6479,my stomach hurt much want cry,0
6480,it still dosent work,0
6481,sod law think christmas sale,0
6482,ive trying call min getting busy signal want request yahoo yodel,0
6483,literally pas lately,0
6484,youre going die im sorry,0
6485,jokingly said seriousness,0
6486,regret getting starbucks want sleep cant,0
6487,think im sick,0
6488,my snapchat lynettelowe cogrccvhom,0
6489,hope okay,0
6490,today weather sum feel going work,0
6491,oh gahd get well soon amber,0
6492,there rumor said zayns gon na back th month just rumor tho,0
6493,bts week ago,0
6494,why time dragging today looked clock disappointed discover wasnt even yet,0
6495,obyun unnie,0
6496,im literally cry right,0
6497,ahhh food poisoning prevalent,0
6498,my name tho miss,0
6499,poorly bed netflix today,0
6500,same feeling sir,0
6501,really want sushi,0
6502,week cant wait week,0
6503,want rt,0
6504,ha anyone managed get yet we keep getting busy message think worse tube strike,0
6505,feel like im going throw,0
6506,good thats inch got nw meck lol,0
6507,cant sleeeep,0
6508,one awake,0
6509,oh well miss,0
6510,delph injured already,0
6511,fresh news still impossible play,0
6512,oh anything yo ucan,0
6513,understand it sad depressing make extremely anxious poc,0
6514,guess blocking number phone spam sm feature wont work nor using specific word since guy write sinhala english,0
6515,no billionaire world no island maldives dheena fasgadah alvadhaau cohaacbqz,0
6516,burned pizza roll,0
6517,how help,0
6518,live countdown app im still confused function can watch desktop,0
6519,my snapchat evelineconrade cokwdxybdbc,0
6520,ive wanted panda like day,0
6521,awful news mum us birthday cake every year st none,0
6522,wan na go back can we go backkk,0
6523,wake cofacjpifp,0
6524,to think could last photo together hate transfer window coryirpagj,0
6525,look relaxing,0
6526,oh im prepared get girlfriend,0
6527,hi dan bad dull overcast rain due later today coyxkurvzk,0
6528,youre inactive,0
6529,ahhh get well soon amber,0
6530,hey yeah couldnt see anything even checked spam folder,0
6531,hate late bc wont wake early end wasting day,0
6532,miss much,0
6533,cant wait truck fixed missin hangin wiff mah friend time,0
6534,music team interactive dept,0
6535,waste cherry bakewell,0
6536,collecting five teal card time getting prize make sad,0
6537,id rather stay sleep weekend go,0
6538,love that episode but skip the doomsday episode please,0
6539,feel cojlivpkmfwg,0
6540,feeling little neglected visit postie today,0
6541,wish got goodnight message,0
6542,didnt read donation,0
6543,wish money afford,0
6544,feel like im weird person shipping bellamy raven everyone ship clarke heart want want,0
6545,miss im busy week how,0
6546,feel bad helmy,0
6547,followed me thanks and please followed me too,0
6548,want want cocvyvbmqan,0
6549,miss uh yr cnt wait uh,0
6550,feel like winter,0
6551,gon na longggg night,0
6552,another ridiculous headache,0
6553,sorry hear hope youre ok havent stream lately got new job stocko back,0
6554,all want chocolate lucozade,0
6555,and people ask dont leave house world scary fucked shooting explosion everywhere,0
6556,happened gyu,0
6557,the worst mental block half remembered song melody head aint leaving cant recall whole either,0
6558,sound like youve reached level,0
6559,followed me thanks and please followed me too,0
6560,wish please get signed xxx comxojdwtr,0
6561,actually they say time mouth open,0
6562,feeling let thought favourite favourite,0
6563,target ftw,0
6564,never enough sleep,0
6565,walking alone difficult but walked mile someone then coming back alone very difficult,0
6566,moving day,0
6567,asked first pfb,0
6568,even nate think dropped place already,0
6569,first time travelling expo worse part ive expo,0
6570,miss you too jisoo,0
6571,went fuck ur chloe reply selfie got anon omg hate chloe,0
6572,like mager wi cocaxwoggwb,0
6573,knw wht im big fan went set bt didnt get chance meet,0
6574,laura dont meet next year im gon na sad,0
6575,still mad knee,0
6576,gutted never went distant world london im well it long,0
6577,stop buffering,0
6578,im going insane the id wrong account wont go away open account,0
6579,charli hot every time shes finland comyixvbct,0
6580,eh guy ganas face ah cobbofcxsm,0
6581,still studio sun coming last good morning arch camp cobqcaccjp,0
6582,they dont love know need,0
6583,name movie sound sad,0
6584,followed me thanks and please followed me too,0
6585,you lyin lmao,0
6586,jealous why covucyeisif,0
6587,feel sick,0
6588,miss hair colour cobczmvlodz,0
6589,me kian love kian love youuuuuu cant get today omg,0
6590,supercars ice cream many gurgaon location pls add location,0
6591,hate see,0
6592,im bored,0
6593,whyyyy le,0
6594,followed me thanks and please followed me too,0
6595,my word satire general situation why hurt much,0
6596,regretting peanut butter sandwich rn sore mouth making thing difficult,0
6597,garden update tree gone covohzz,0
6598,beer lovely,0
6599,my assignment failed,0
6600,say hello viners palembang please,0
6601,im sorrrrryyyyy,0
6602,aww amber,0
6603,im sure fany happy,0
6604,sad sad sad kid ok help watch match hahahahaha,0
6605,it early day boner have mercy,0
6606,am mad yuki egg see im mad cohjkvkgoa,0
6607,look like finally time get rid old cowvqhzyxjuc,0
6608,ever hear mary know live coefhzjgv,0
6609,jake gyllenhaal talk impact heath ledger death cooiyoolagv via,0
6610,miss btw,0
6611,see oh hunny know im end line need friendly ear know ive said still stand,0
6612,data depleted wish could come back say im sorry mbasa joking im still,0
6613,break heart cause im hard,0
6614,kat office client,0
6615,esp came hour ray hope make feel like cry go back,0
6616,aah maybe theyre type block people easily least nothing personal yeah still suck,0
6617,anybody collection suit episode season pa copy,0
6618,woke another migraine need proper rest moment cant,0
6619,now made really angry sad no new biome,0
6620,mosque sit outside whole time smelly im annoyed,0
6621,this taxi emptier ciaras concert,0
6622,stomach hurt bad,0
6623,fun even though wont able see,0
6624,hope everythings ok hug,0
6625,omg nooo corbkiail,0
6626,im tired wtf,0
6627,vine luke clip coubolwacw,0
6628,aw bb,0
6629,yeah tall,0
6630,dont wan na go home bring english food ill gladly stay,0
6631,im sorry,0
6632,im sorry,0
6633,hahahaha wasnt intention turned away said something turned thats kissed,0
6634,ambs please harrys jean,0
6635,mayday parade feel,0
6636,know right huhu sad lyf cormdmcuyynh,0
6637,august th,0
6638,sad new animal kingdom coincinihz,0
6639,you saw chris brown copmmxogpen,0
6640,cute coknujxazja,0
6641,miss mom,0
6642,yeah bit risky count,0
6643,come back cologne please,0
6644,followed me thanks and please followed me too,0
6645,doesnt help itunes doesnt work cant buy anything,0
6646,weather app say rain tonight tomorrow sit car watch footy,0
6647,no babe,0
6648,wan na duo,0
6649,like ballad idk,0
6650,need massage,0
6651,wtf body goal,0
6652,but told im becoming bit bish maybe shouldnt,0
6653,our lovely intern leaving today look yummy treat brought cozriuoyoh,0
6654,cathys story basically black guy singing,0
6655,missyou bishes,0
6656,ruby rose ko tou maine pora stalk karlia omg beauty khatam bandi pe tf shes pyaari,0
6657,oh gawd really need get understood whole thing,0
6658,great review massis tea we miss corwejeuojg,0
6659,on loop bad news people provide feedback though,0
6660,packing nightmare,0
6661,ofc allowed fan managed take picts risk caught security got kicked,0
6662,oh dear,0
6663,aishhh stream getting slow viewer,0
6664,exam soon sigh,0
6665,it burnt toffee,0
6666,okay doesnt want talk stop,0
6667,true honesty lonely word,0
6668,ive ran protein,0
6669,want coaznzoscb,0
6670,sissi made tote bag birthday use time slowly breaking make really sad,0
6671,im going sleep upset,0
6672,miss church helping get armor,0
6673,no delphy,0
6674,miss hate pll,0
6675,teen top actually performed rain yesterday fk ok im still proud la,0
6676,whens cat coming,0
6677,sel beth come serbia serbian selenators motavators sad comqrhlguv,0
6678,poor kid momma died,0
6679,happend kian okay,0
6680,awww imperative,0
6681,cleaned room yay panas af,0
6682,that quickest blood test ever arm hurt,0
6683,slept cause really didnt wan na see everyone get jacob ticket wasnt allowed,0
6684,fuck sake hamstring injury delph another rodwell,0
6685,none friend came,0
6686,what wasnt supposed august,0
6687,problem tracing many people claim artist work,0
6688,get called tp law,0
6689,we dont chocolate milk powder anymore,0
6690,teeth smile wider,0
6691,this honestly make sick stomach rip lost life last night coyanpip,0
6692,pain tummy back keep waking literally cant get comfortable,0
6693,notice working,0
6694,followed me thanks and please followed me too,0
6695,thank bruno made,0
6696,wish going ed croke park today,0
6697,ha anyone deal toll get package dont understand website,0
6698,still back shape,0
6699,went wasnt much swear im unluckiest bettor,0
6700,followed me thanks and please followed me too,0
6701,nstp class tomorrow,0
6702,unit first sem second year please tell youre kidding,0
6703,got google image dont know bc already closed browser sorry,0
6704,im tan,0
6705,still really really really really really like chipotle chick fil stole heart,0
6706,lucky dont ramadhan holiday eid thats week need,0
6707,hard save live,0
6708,nickyyyyyyyyyyyyyyyy wtf,0
6709,seriously dont want go back,0
6710,followed me thanks and please followed me too,0
6711,dont fucking play emotion please started,0
6712,got image header website wont centralise,0
6713,we discontinued product sophie really sorry disappointment we pas feedback,0
6714,tbh idk ask around,0
6715,it kate tho,0
6716,it buffering,0
6717,let speak struggle,0
6718,aww damn haha,0
6719,please follow,0
6720,so glad dont bother make work been outside morning face would gone drain bloody rain,0
6721,precious never end,0
6722,fab therese hahahahaha cred coqcwvinjm,0
6723,it ended so soon tt it hurt one eliminated theyre good smtm,0
6724,ty come home tonight tho,0
6725,doing assingnment whilst watching game lol hate life cosxehluhq,0
6726,awwww thank editied old phone dont work,0
6727,nakaka beastmode lost id,0
6728,oh my gaaawd cozadjgjzf,0
6729,jane said im welcome,0
6730,yes love mango ice candy robs fun could,0
6731,unfollow please follow colombia love,0
6732,future didnt show,0
6733,thanks yots labyo miss,0
6734,get well soon pretty pano mo nalamannn bebeee thankyou cocvotdgray,0
6735,oh im early,0
6736,damn stole home girl phone toogot fucked,0
6737,need stop hardheaded,0
6738,that lonely moment text message get day cell phone company,0
6739,call baby know im not the only one eating zachs burger xpress,0
6740,thats true trying get rid katie hopkins avail,0
6741,im really,0
6742,cant sleep,0
6743,every night take hella melatonin every night take like hour nap im wide awake next day,0
6744,determined feel ill tonight,0
6745,so cold office huhu no task ill pm hahaah,0
6746,miss chris voice cohouvsql,0
6747,oh thats shame were really looking people written frequently but thank,0
6748,hope person jail couyofsgibva,0
6749,everyone happy bc amazing friend bc still waiting internet bestfriends,0
6750,head ache,0
6751,need donghyuk stans tl guy,0
6752,miss beks original body since episode,0
6753,reynoldsgrl either deactivated got suspended wanted shade,0
6754,got home heavy rain,0
6755,haha feel naked without ole beardy tho,0
6756,how get ive trying age joy,0
6757,want sleep tired,0
6758,song freaking saaaaaaad,0
6759,sorry guy new video week,0
6760,aw thats shame thought well miss,0
6761,followed me thanks and please followed me too,0
6762,happen kaussies,0
6763,looking forward pixel movie turned bummer,0
6764,okay bae okay wan na hug already cobgvmxyfgt,0
6765,michael exercising and yeah it great and all but dont want him to lose the tummy,0
6766,done please pick,0
6767,finding old picture long hair make sad,0
6768,ive supporting since start always ignored please let today day finally follow,0
6769,wet miserable missing morning yoga drink sunshine love xx,0
6770,thats mean dont like rude also aww bc keep away snake damn shouldve moved,0
6771,fucking shit stalking account,0
6772,zayn coming back july srsly guy many time say,0
6773,georgia saffron amazing queen poor peasant wish could like,0
6774,got sleep,0
6775,ahh im sorry didnt reply back miss also wouldve tweeted acc ive,0
6776,nfinite new update hoya slp coqflzf,0
6777,the saddest thing feeling real look around realize shoulder,0
6778,laomma design kebaya wedding dress bandung indonesialine laomma dfwhatsapp instagram laommacouture,0
6779,no cant,0
6780,feel drained like omg like tired physically mentally haizzz eye still hurt urghhh sat sun cant even stay home,0
6781,im really trying hard level working tight schedule art comic know sometimes art look ganbarimasu,0
6782,im feeling lonely wth conrxegjsv,0
6783,livid still working,0
6784,oh actually made sad lol,0
6785,wan na sleep,0
6786,double whammy,0
6787,how unlucky would dying passed away ed came stage,0
6788,ive supporting since start always ignored please let today day finally follow,0
6789,quuuuuuee friooooo,0
6790,ive supporting since start always ignored please let today day finally follow,0
6791,raining much running,0
6792,ive supporting since start always ignored please let today day finally follow,0
6793,dad said sorry,0
6794,ive supporting since start always ignored please let today day finally follow,0
6795,fat lady part,0
6796,ive supporting since start always ignored please let today day finally follow,0
6797,please take,0
6798,wtf stereo kick,0
6799,hopefully chwang still drag eat later sob,0
6800,add kik lorm cowjltafy,0
6801,cant stream,0
6802,feeling unhappy today,0
6803,omg amber,0
6804,looking fun snapchat jennyjean coswlxvfdev,0
6805,hey mean,0
6806,told survive living alone rest life cant even left alone day,0
6807,well rude,0
6808,wan na buy,0
6809,no didnt hahaha wish you,0
6810,lolzz unfortunately dat,0
6811,keep worse dream corey,0
6812,appreciate weekly update weapon ever way nowhere put one already,0
6813,yup thank huhu mahirap,0
6814,dead guess time get sleep hope work later today get game nash,0
6815,my body system dont want accept food,0
6816,oh gosh love much fried noodle love stopped selling,0
6817,london veeeeerry wet today like summer know,0
6818,saw rted orig tweet starholicxx,0
6819,justinbieber pls follow daianerufato ive trying long ilysm baby xx july am,0
6820,kidding get feeling,0
6821,song from fifth album am so notr ready hwy is niall so cute cothmlvqldaw,0
6822,nothing except lie fraud double cross diplomacy survival fittest zero tolerant,0
6823,hug really wish could love miss,0
6824,always remember take shit bb gurl,0
6825,were sorry hear how try following step coemkbtyke let know get,0
6826,so true yet many know choose heed notion xx,0
6827,unfortunately today performance pier approach going ahead due weather copidhdmga,0
6828,cry get rattle robe,0
6829,just looked previous tweet seen message due hack hope got sorted,0
6830,like ballad think emphasis vocal lot im happy chose promote one,0
6831,they sold,0
6832,erm whats like,0
6833,cant announce cool show today wait monday thanks,0
6834,hey abby help persuade mum come see london please,0
6835,lmao realized tweeted wrong lyric,0
6836,emilys birthday,0
6837,packed sock camping wear odd sock,0
6838,cant see possibly elected far much baggage but people see want see,0
6839,so cold,0
6840,maverickgamerjuly pm,0
6841,no mean hmm omg im slow,0
6842,shiiiit kami beh thank bby miss love mwa,0
6843,my mommy left,0
6844,hi ate know love much maybe shes hard time right,0
6845,very sad return holiday find radio morning bc drive,0
6846,dat fun lasted,0
6847,why people scream much beforeduring fighting youre hurting throat stop,0
6848,is cat cafe in melbourne,0
6849,movie marathon anyonneeee loner af,0
6850,so fricken cold,0
6851,thats annoying thats one im using really good,0
6852,meh rito pls something,0
6853,although panel start im gon na miss everything,0
6854,repeat audience,0
6855,got one month june,0
6856,take back hsm canarios park hotel colvnojfgf,0
6857,im sorry im getting personal stuff really bothering cant stop cry dont anyone talk,0
6858,wonder im gon na see ukiss member one,0
6859,wish faith well meet sam kurt one day one day,0
6860,friend fatmam,0
6861,damn alex swag,0
6862,lmfao seriously cant remember honestly likely tho,0
6863,please follow waiting follow back please follow back retweet reply,0
6864,update cohphncquvy via,0
6865,oh forgot id missing cake flapjack,0
6866,want ihop,0
6867,dont snapchat,0
6868,yep oh common infra still rolled country,0
6869,done please give know im late sorry,0
6870,thank bby love,0
6871,can call work,0
6872,last day,0
6873,want sleep,0
6874,nd thought college,0
6875,guy stream stream lq im,0
6876,word like knife,0
6877,cant sleep cause ive worst anxiety day ugh stay home tomorrow,0
6878,wa exited get maccies breakfast minute late get burger cheese bite,0
6879,amazing such short trip though wan na go day hows spain,0
6880,sorry mr,0
6881,pleased went well wayne shame couldnt,0
6882,wtf make new giveaway acc cant tweet anything,0
6883,wan na talk people im scared find annoying tend ignore interested talk,0
6884,could get black blue silicon cover,0
6885,no one thank bc kbye,0
6886,btw ini sore say,0
6887,hate didnt first win yet,0
6888,anytime lil nigga,0
6889,tried support uk citizen sign,0
6890,low compared ranking mcountdown,0
6891,kid make,0
6892,people change always good,0
6893,im sure it would sad see go thapelo op,0
6894,chocolate peanut,0
6895,civ crashed middle marathon game,0
6896,wooden mic neh,0
6897,that embarrassing texted wrong organization gosh,0
6898,lost excitement birthday,0
6899,hate people dont text back,0
6900,my mouth cant translate thing heart say,0
6901,today dont,0
6902,mine still isnt working wtf missed daily chance going miss mecha totem keep,0
6903,this feeling miss badly,0
6904,nak tgk paper town sigh,0
6905,too early,0
6906,jokid codolyfreoyyy,0
6907,miss kid cant believe im adult stuff like paying rent bill degree shit like fuck,0
6908,tomorrow please,0
6909,yes inconsiderate,0
6910,pray kid,0
6911,wow miss long hair brace softball coxysusbfxk,0
6912,anna cojxjronpcy,0
6913,followed me thanks and please followed me too,0
6914,apply tomcat,0
6915,miss you chel,0
6916,we dont like sound jemma try following network step coilhquyh let know,0
6917,idk use,0
6918,good im receiving delivery otherwise leave detailed list offer oh need check,0
6919,matchy matchy elsa hair love soo much cogysqarggu,0
6920,please dont postpone longer,0
6921,karin honey want another vist,0
6922,im gon na get high blood pressure one day lol im eating much unhealthy food coinhikivf,0
6923,pain propa knockin sick owwww,0
6924,bacon sandwich marketing office im pre holiday diet boooo,0
6925,followed me thanks and please followed me too,0
6926,im confused what put inital location asking location destination,0
6927,happened love,0
6928,so member just victoria amber luna and krystal no giant baby corxtjdtelw,0
6929,come singapore,0
6930,last concert went stadium tomorrow show justin,0
6931,why cant retweet stuff,0
6932,gon na sarajevo live like hour,0
6933,team fallen apart unfortunately energy seems,0
6934,haix wish sp student everyday go breakfast im late class already haix,0
6935,followed me thanks and please followed me too,0
6936,wii bayonetta the wonderful really sell poorly,0
6937,yeah saw tweet completely agree moving quick enough transfer though,0
6938,dropped cojkopvofnqq,0
6939,work longer really doable drove train awful moved agency long story miss everone though ok,0
6940,dont gon na order jps soon hopefully,0
6941,miss mamabear much,0
6942,thought finding someone hard finding trying make stay harder,0
6943,oh suck,0
6944,need go school shopping school start almost week,0
6945,followed me thanks and please followed me too,0
6946,ugh just want to be with you right here and right now need ya tay you one understands,0
6947,true voted many time underrated like slovakia entry,0
6948,know saklap,0
6949,sadly cant see grade yet bc hold order rizal lib,0
6950,baby colmaajkmvk,0
6951,gon na miss,0
6952,im watching im working im interested man city anyway hope lose,0
6953,wanted go dont live near place,0
6954,wasnt class entire school discus advisory period one took seriously,0
6955,ja dit dus know feel,0
6956,life harsh sometimes,0
6957,school start next monday ohgod,0
6958,my kik abligaverins cognbnvmtuc,0
6959,such positive beautiful light cogpmwgos,0
6960,followed me thanks and please followed me too,0
6961,want to cri have no one to go coipxqmqwfem,0
6962,oh didnt so sad catching today,0
6963,oh damn true that moment realize holiday almost youve done nothing,0
6964,miss edel aww,0
6965,salam dear brother eid mubark sorry ive missed ur show eid feeling badsad,0
6966,hp low dong,0
6967,this way common,0
6968,snapchat tammirossm couxbrqworb,0
6969,saw mine huhu coveyvcngs,0
6970,snapchat tammirossm coizwwflzv,0
6971,miss speck online babe,0
6972,my snapchat abbymill coibtzcjzh,0
6973,ion wan na hear,0
6974,yeah thinking,0
