,Sentence,Class
0,top engaged member community week,1
1,hey james how odd please call contact centre able assist many thanks,1
2,listen last night you bleed amazing track when scotland,1
3,yeaaaah yippppy accnt verified rqst succeed got blue tick mark fb profile day,1
4,this one irresistible coebzlvenm,1
5,we dont like keep lovely customer waiting long we hope enjoy happy friday lwwf cosmyyriipxi,1
6,on second thought there enough time dd but new short entering system sheep must buying,1
7,jgh go bayan bye,1
8,act mischievousness calling etl layer house warehousing app katamari well name implies,1
9,top influencers community week,1
10,who wouldnt love these big juicy selfies coqvzjgdufo coowbleqry,1
11,follow corcvcyyoiq follow back,1
12,perfect already know whats waiting,1
13,great new opportunity junior triathletes aged gatorade series get entry coofdyozml,1
14,laying greeting card range print today love job,1
15,friend lunch yummmm,1
16,id conflict thanks help here screenshot working,1
17,hi liv,1
18,hello need know something fm twitter sure thing dm cowdybv,1
19,top new follower community week,1
20,ive heard four season pretty dope penthouse obvs have fun yall,1
21,yeah suppose lol chat bit,1
22,hello get youth job opportunity follow,1
23,havent seen year,1
24,hope rest night go quickly bed got music fix time dream,1
25,spiritual ritual festival npal beginning line it left line see coqmnzoeuc,1
26,hey sarah send email bitsy com well help asap,1
27,my kik hatessuce cotnhjdyzf,1
28,come house,1
29,effective press release distribution result link removed,1
30,hi bam can follow bestfriend she love lot see warsaw love,1
31,everyone watch documentary earthling youtube,1
32,follow corcvcyyoiq follow back,1
33,top support community week,1
34,buuuuuuuut oh well,1
35,looking forward visiting next week jo,1
36,make feel better never see anyone kpop flesh,1
37,good girl best wish,1
38,great enough reason listen one epic soundtrack,1
39,thank shout have great friday,1
40,added video playlist coyzpfsmxuq im back twitch today going league,1
41,would love see dear waiting,1
42,oh okay thanks,1
43,like fake gameplays haha im kidding im kidding you good stuff,1
44,yeah exactly,1
45,our new product line shop check cohexctlqxg,1
46,hope vacation going great,1
47,rechargeable normally come charger buy,1
48,top engaged member community week,1
49,well shes asleep one talk sooo someone text,1
50,yes suppose bet hell blue fit hearing speech today pity,1
51,green garden midnight sun beautiful canal dasvidaniya till next visit,1
52,scouting sg future wlan pro conference asia,1
53,good better change lollipop,1
54,we nez cocgvimhsinz,1
55,follow please this big dream,1
56,mama reason stand stronger,1
57,follow corcvcyyoiq follow back,1
58,oh my god misty my baby is so cute,1
59,love blue cohnbinhes,1
60,woohoo cant wait have signed yet still thinking mka,1
61,liam access,1
62,stats day arrived new follower no unfollowers via copksiha,1
63,shouldnt surprised amazing figure,1
64,top influencers community week,1
65,wishing best beautiful sweet talented amazing cohumtctri,1
66,plan day drain great,1
67,got ta love timezones,1
68,parent proud lol least maybe sometimes get happy grade al cobjjegioogu,1
69,grande cogsaaxnpru,1
70,manilabro chosen follow twitter colkxzwxnfb thanks follow,1
71,sure let know youre around side world take care,1
72,top new follower community week,1
73,finally fucking weekend,1
74,hi bam can follow bestfriend she love lot see warsaw love,1
75,yes joined call gift got ta get covalveomdt,1
76,dm make night better,1
77,joined event might get text day luv cokgfgawdhy,1
78,would really appreciate share video around comhkbwopq,1
79,hello get youth job opportunity follow,1
80,oh wow that beautiful tom,1
81,love you cowxyrresv,1
82,added video playlist cohvvphsyaka im back twitch today going league,1
83,top support community week,1
84,follow corcvcyyoiq follow back,1
85,gym monday cant wait like,1
86,hey here invite join scope influencer corzgztqfjt,1
87,those friend know,1
88,waiting nude,1
89,go sleep,1
90,stats day arrived new follower no unfollowers via corbpmngmeo,1
91,my birthday week today,1
92,want youre shirt they cool,1
93,haw phela looking like mom obviously looking like,1
94,prince charming stage coonvfhztfz,1
95,really good luck,1
96,stats day arrived new follower no unfollowers via coxzsogaczk,1
97,top engaged member community week,1
98,tyler hipster glass,1
99,hey marty glad see twitter,1
100,hi joining today,1
101,done thanks,1
102,it already afternoon let read al kahfi day finish,1
103,ohmyg yaya dub im done stalk ig accnt gondooo moo tologooo haha,1
104,here invite become scope influencer detail coipjyoiget,1
105,top influencers community week,1
106,thanks zzz xx,1
107,physiotherapy friday hashtag today custom,1
108,know monica miss yeah sound good,1
109,good morning beautiful thats take,1
110,hi bam can follow bestfriend she love lot see warsaw love,1
111,oh yeah definitely going try tonight took advice we treviso,1
112,follow corcvcyyoiq follow back,1
113,hi would like concert let know city country ill start working thanks,1
114,fine have gorgeous friday friend xo cojmpkzpdai,1
115,oven roasted garlic olive oil sun dried tomato dried basil century tuna coesccqhlob,1
116,right back atchya have great day everyone,1
117,doesnt even follow back,1
118,the future almost corolezcl,1
119,top new follower community week,1
120,no chance,1
121,go po ice cream,1
122,hehehehe thats point,1
123,next time stay home,1
124,top support community week,1
125,soon promise,1
126,web whatsapp volta funcionar com iphone jailbroken,1
127,plan watching later min leia appears hologram rd message obi wan sits luke,1
128,inter ucl arsenal small team right,1
129,just passing dewsbury railway station dew dewsbury west yorkshire codvbsshbrfx,1
130,live scotland strange imagine megan xx,1
131,shweta tripathi,1
132,over kurta and mom half number,1
133,ah hello back larry coxhjjbjth,1
134,anyway friday looking kinda gooood,1
135,follow corcvcyyoiq follow back,1
136,lol well thats life thank god enn cogloceijgqq,1
137,surely could warmup morning coming th bath xx,1
138,dum dum andar ram sampath sona mohapatra samantha edward mein tulane razi razi wah thats josh coulmardfhm,1
139,always smile,1
140,thanks time right thats perfect timing,1
141,top engaged member community week,1
142,we already given gas subsidy long back initiative proposed feeling delighted done,1
143,missed yesterday,1
144,hi bam can follow bestfriend she love lot see warsaw love,1
145,lmaoo the best song ever we shall little throwback week,1
146,go outlying island cheung chau mui wo totally different,1
147,kitchen clean im totally amazed,1
148,follow corcvcyyoiq follow back,1
149,cusp testing water hope rewarding,1
150,top influencers community week,1
151,arummzz let go ill drive cosyysjeu,1
152,anyone wan na skype,1
153,may look bit real nice friendly girl,1
154,im like but pretend,1
155,watching concert film,1
156,congratulation youre winner contest please dm address contact number,1
157,have great weekend guy codldklpetab,1
158,top new follower community week,1
159,cool seeing film today,1
160,check email marketing coofjroeqk wont regret buy,1
161,lol come join see around hour leave without delay,1
162,actually easy like must station guess train wd take least hour shifting engine etc,1
163,sunburn peeling,1
164,visit blog couzoaqrowkx thanks,1
165,hi would like concert let know city country ill start working thanks,1
166,talk help,1
167,huge warm welcome finally complete triangle,1
168,live northern ireland sight seen,1
169,follow corcvcyyoiq follow back,1
170,top support community week,1
171,stats day arrived new follower no unfollowers via coprugvmouc,1
172,feeling smthng smthng fr lol wan na hug xoxo love uu jaann take care,1
173,thanks mom,1
174,thanks happy connect,1
175,wonderful thing made feel fluffy inside great pirouette moose,1
176,trip philly december id love come dude,1
177,hi bam can follow bestfriend she love lot see warsaw love,1
178,the question flawed pain doesnt negate strength cotbksdjw,1
179,you went solo move werent made,1
180,hey fav nirvana song smell like teen spirit rip amy winehouse,1
181,top engaged member community week,1
182,let go ill drive cosyysjeu,1
183,name couple yet,1
184,love goodnight vid going wake love one,1
185,this weekend gon na shoot lovely here picture made last time cosedmpt,1
186,itty bitty teenie bikini coaoxwzig cojnksfhwrc,1
187,joined event might get text day luv coczdowiw,1
188,always much fun th hour get together ending night ice cream xfiles content,1
189,yes surprised dont see bit rain today,1
190,follow corcvcyyoiq follow back,1
191,to fabulous friday keep fantastic work,1
192,please follow please jb follow love always forever im belieber love,1
193,top influencers community week,1
194,good hear,1
195,nighty night dont let bed bug bite,1
196,very beautiful bracelet good idea,1
197,waiting foundry where,1
198,like game,1
199,ah now make sense didnt see pic effing phone last night woot,1
200,hi derek could try using parkshare gloucestershire coqifayalkc,1
201,aaaahhh man track traffic stress reliever,1
202,top new follower community week,1
203,howre today dear,1
204,hear guy want arbeloa,1
205,turning day omg least year difference,1
206,well say europe rise find hard believe,1
207,uncountable coz love unlimited,1
208,yes course cosaixvpfjf,1
209,yes love,1
210,thank rita,1
211,hi could please dm info wed happy help,1
212,way boy,1
213,hope get lot nice gift,1
214,hi bam can follow bestfriend she love lot see warsaw love,1
215,top support community week,1
216,so true conorwrowhd,1
217,added video playlist cogusumrnb im back twitch today going league,1
218,sethi high,1
219,exe skeem saam,1
220,these people make smile coiddtackak,1
221,thanks invite,1
222,polite izzat wese trust khawateen sath selfies say mana kar deya,1
223,thank thats friday evening sorted,1
224,nice hair tbh,1
225,year cohjehdmxuu,1
226,jacob mg upgrade,1
227,nice tee man,1
228,happy family vacation pic cohlfwmsf,1
229,sleep would nice,1
230,if youre reading youre beautiful like read,1
231,talking one person having two conversation,1
232,skype fun,1
233,friday corazlpjo,1
234,top engaged member community week,1
235,something get great start have great day colshgwcxssv,1
236,follow corcvcyyoiq follow back,1
237,square enix bissmillah ya allah,1
238,training startup week wed love drop youre arnd town,1
239,basically piss cup test,1
240,also twitter terrible complicated discussion,1
241,snapchat lynettelowe cokdmiam,1
242,looking forward hour shift today,1
243,definately agree growing sport drop email detail see,1
244,my last rt,1
245,rakyat keep visiting blog reading writing coimrybxuzd,1
246,ever since mentioned fly fishing day im getting follows promoted post lol cyber stalked,1
247,proud you papa coach,1
248,great talking,1
249,never see positive kha could also mention atleast going,1
250,hi bam can follow bestfriend she love lot see warsaw love,1
251,the mango lassis montys marvellous though suspect thats meant,1
252,top influencers community week,1
253,haha yes hr the time come touch kepler chalna hai,1
254,follow corcvcyyoiq follow back,1
255,thankyou pretty,1
256,definitely hazel food market brooklyn pta coysqkhndob,1
257,still awake,1
258,awww thank cotsqvdwvm,1
259,ha that surprise least okay see doc afternoon yorkshire splendid though xx,1
260,spam folder wow huge amount need travel nigeria claim,1
261,rted good luck,1
262,my leg hurt bad,1
263,get mine saturday,1
264,thaaanks december puhon,1
265,happiness coslonoues,1
266,true can change tnc without prior notification could used last night,1
267,probably find funny,1
268,fat co probably ate yuna,1
269,have fun tameside,1
270,youre welcome,1
271,my google account corjydxlqyo,1
272,call scouser everything hope zoe well mate,1
273,right literally like maybe get people actually know theyre,1
274,sameee rest well cotzconxdg,1
275,happy birthday edgar hope good one keep updating travel log,1
276,bring abes,1
277,stats day arrived new follower no unfollowers via coxxlxsxywe,1
278,someone talk,1
279,never ever meet,1
280,come man,1
281,follow corcvcyyoiq follow back,1
282,hi bam can follow bestfriend she love lot see warsaw love,1
283,sigh dreamily pout come bath eye,1
284,happy birthday love,1
285,funny happened phil,1
286,id call em del rodders what else,1
287,hi may like play newest gamejam game would happy cojvoddhcs,1
288,this great irish literature really inaccessible without irish,1
289,yeah this fun,1
290,nice music check copejhsorgrk,1
291,strange kareenas fan not knowing kareenas fan,1
292,hello get youth job opportunity follow,1
293,cool will look,1
294,beautiful cofvmcie,1
295,im playing brain dot cochljvuxn cogggupyeji,1
296,thats fair enough wouldnt rush back either,1
297,brandi fb drop selfie fun cotroroesfk,1
298,follow corcvcyyoiq follow back,1
299,during carnival men put mask mask xavier forneret,1
300,jennifer check site wan na get free ball pool coin thank,1
301,beautiful edit trish loved,1
302,gratefulness happiness post three thing youre grateful today comment,1
303,love wakeup beside real dirty dirty sex codplyrltjil,1
304,lmaooo same hot like louis he hot,1
305,just gon na throw idea cause theyre bad inspire think something much better,1
306,the best twoofs follow gr wkend cofiyprtai,1
307,wish could maybe one year,1
308,hey guy,1
309,think need go bed kind exhausted good night twitter,1
310,thank much so glad liked,1
311,it get better time,1
312,kind word thank much it much good area,1
313,hi beautiful follow please,1
314,they werent kale crisp why ruin good thing,1
315,hi bam can follow bestfriend she love lot see warsaw love,1
316,open worldwide,1
317,get fuck outta conejdaaqwz,1
318,cool guy it release they work,1
319,it really look vantastic,1
320,today finally time work xcylin,1
321,thank so bundle show internet price phone realisticly paying net,1
322,true education powerful weapon use change world nelson mandela,1
323,follow corcvcyyoiq follow back,1
324,most recent trip jk totally loved dand thats chenab flow pakistan coehncmxzl,1
325,caught first salmon today,1
326,happy friday just checking see enjoyed super blend,1
327,thanks following do get touch youd like info project youth org uk,1
328,please go check awesome friend stream couvbdidwdw he fantastic artist,1
329,my alma mater faith christian school cooiwrwofuy,1
330,good luck upcoming uk appearance corexrotfbp,1
331,lol really cant believe beautiful girl like single,1
332,never listening the hill every,1
333,would listen beat what went wrong life,1
334,haha thats great,1
335,getting everything ready natural pefumery workshop neals yard covent garden tomorrow cowyeecbqoz,1
336,fback indo harmos,1
337,love way,1
338,always remember,1
339,aww thank beautiful pic cohfirc,1
340,hi saw follow thought might like dark coqsaoyocik plz let know think,1
341,smart handshome cute juga codclujk,1
342,hurray looking forward meeting,1
343,follow corcvcyyoiq follow back,1
344,cause hate course lol cant decide want change im going take time save maybe travel,1
345,it list im still show,1
346,hi would like concert let know city country ill start working thanks,1
347,oh awesome thank much,1
348,youre perfect,1
349,hiya email web exec loryn good chamber co uk able help,1
350,enjoy photo beforewhen mom baby cowqzetbvqu,1
351,big thx kind support good luck,1
352,china actually girl that homosexual but love himher either way,1
353,cause like lot,1
354,give time fam got thing mind,1
355,thanks god friday,1
356,not quite sure radio set heart,1
357,hiii jack ily,1
358,played domino pub it got quite heated enjoyed though,1
359,enjoy and sorry hastily typed message,1
360,can say big thank person came idea screenshotting,1
361,we true pakistani,1
362,hi bam can follow bestfriend she love lot see warsaw love,1
363,point gooo bailey,1
364,you drank,1
365,old pic,1
366,follow corcvcyyoiq follow back,1
367,havent gotten sleep hour,1
368,off today yippee cobdaxvfye,1
369,happy birthday baby miss you so much and love you so much,1
370,thanks bro,1
371,thats lord cooxavalpn,1
372,sweet cowcvvnxe,1
373,we like michael thanks kind word cheer em,1
374,morning not really ure already fun cause weekend right ure future have amazing night,1
375,waiting people call bigot cowgvmysv,1
376,it usually are front back squat,1
377,much fun really enjoyed hope next contest coming soon,1
378,dobar dan the brand new heavy coejdalpfixn,1
379,look like great way spend friday afternoon enjoy marathon iflix,1
380,if need someone talk always keep head,1
381,officially graduated cobjxlilpi,1
382,im glad did cry coybgimoxne,1
383,yep expert bisexuality good luck,1
384,minal aidzin yo pi,1
385,follow corcvcyyoiq follow back,1
386,the plan read brand new cook book figure make dinner tonight,1
387,lol tough choice tbh really like every song others,1
388,chill smu oval dcoz basketball player whahahaha coysdczrmk,1
389,the moment decide log onto account havent year moment saw best thing ever copubjodur,1
390,if girl my wardrobe would,1
391,new user,1
392,welcome back,1
393,oh apparently im already member lol hopefully able come depends time,1
394,greatly appreciated,1
395,hi made change design hope like coextyqb,1
396,ahhh yes,1
397,th cinepambata video festival complete mechanic official entry form may downloaded coyayzabthtx sali na,1
398,hello get youth job opportunity follow,1
399,follow corcvcyyoiq follow back,1
400,ur mom getting swishers ur copping monday coqedmljlrnt,1
401,my song week ducktails surreal exposure cobexvwhzir jingly jangly loveliness,1
402,it tomorrow are follower going come say hello stand high street,1
403,good luck assessment today copopxushab,1
404,mental strength,1
405,looking beautiful you amazing body you ooze sex appeal xx,1
406,home amassiveoverdoseofships coqloeguqlatest vid way enjoy visit site,1
407,isi chan,1
408,stats day arrived new follower no unfollowers via couotftcq,1
409,thanks follow gemma enjoy new orleans,1
410,finally caught,1
411,it funny next anime umaru,1
412,great singer,1
413,follow corcvcyyoiq follow back,1
414,look like game ship got order,1
415,take room car im gone cool cokqxsnyxk,1
416,going streaming soon,1
417,hi would like concert let know city country ill start working thanks,1
418,hahaha everyone fun story related song we got labeled worst batch principal due,1
419,get stuff like march release one first starting new one,1
420,top twoofs wooftastic wkend guy cofiyprtai,1
421,well received necessary comrajmgmnm,1
422,long time see,1
423,ill regret rn tomorrow morning whatever,1
424,that hat,1
425,never love life isonly success,1
426,then wtf never happened moment may may like but there surprise thrown,1
427,start middle finished coketent,1
428,im back twitter,1
429,ended happy,1
430,lovely stuff this need repeated relentlessly approximately next year,1
431,hug many,1
432,oldschool runescape,1
433,thanks shout have wonderful weekend,1
434,rest day coyqawkhapi,1
435,lovely daaay,1
436,all feeling blessed,1
437,awww pussycat xx,1
438,hope everything going great lol,1
439,market main launched pretoria,1
440,do care care coglrlmr,1
441,tykksin videosta copdakaodmx sub special paysafecard giveaway lue desc,1
442,month waiting finally hoodie eeeep yay,1
443,mmmmmm lovely azz set babe,1
444,thx feedback glad gained value,1
445,good night lovely hope peaceful night rest feel refreshed wake sweet dream,1
446,ill never get used thank much,1
447,thanks manthan stay tuned,1
448,freshness beautiful smile mother determination make day,1
449,im playing brain dot comifddscqs cowtiwoeatpj,1
450,please james what you think of my beautiful girl are the loneliest tattoo you changed life coywvusgu,1
451,hi girl wish happy we,1
452,achieved together thank rashmi time dedication complete inspiration,1
453,weekend nearly,1
454,it updated soon im sure if sign set text alert da,1
455,something new coftbwoqhm,1
456,dang rad cobiktbht,1
457,massive congrats niamh fennell journalism graduate land dream job copying pasting tweet codbbjtrk,1
458,stats day arrived new follower no unfollowers via cokfqcxzsvot,1
459,yes thank,1
460,ariana grande selena gomez louis tomlinson rita liam payne caradelevingne trade solo dm,1
461,tired but fine,1
462,nope definitely still apply year want,1
463,ah found thanks,1
464,follow corcvcyyoiq follow back,1
465,thats exactly look im going,1
466,koel mallick recites national anthem on day coorqaupvvz,1
467,monjuly uk thurjuly itv colyxdibyoo,1
468,only one leg september so perhaps bb promote full album september cozvhdzbnm,1
469,still fully intend write many game design possible and attack plan next month,1
470,to bird come join little fun coezmlwu,1
471,hope clear wkend good one,1
472,time sleep,1
473,thats three word but thats rohit coyacaznth,1
474,gorgeous queen god,1
475,the long wait,1
476,if didnt get inspired sheer fact obama beat innumerable odds become president ni shauri yako,1
477,everyone go drop follow stream cowmazjqok,1
478,happy birthday sunday hope great day lot pampering love,1
479,twas great thank,1
480,im going cabincrew interview langkawi st august please wish luck coevjxiuw,1
481,thank you,1
482,fulfil fantasy cobpjroakrb cojtsnmudpnf,1
483,cool thanks thinking hope well,1
484,follow corcvcyyoiq follow back,1
485,thank much babe,1
486,ex twelebs side please,1
487,thanks bro,1
488,great day,1
489,make much sense lol,1
490,have great weekend,1
491,family friend,1
492,an apartment makeover coctlajppdb great idea factory living,1
493,thanks welcome hope go brilliantly,1
494,happyyyyyy birthdaaaaayyyy,1
495,come kill,1
496,hi im interested internship program but sadly cant access career page can help issue,1
497,it sad hear thank much overwhelmingly beautiful game thank hard work,1
498,aha yes who looking forward seeing,1
499,happy friday beaut coaahlv,1
500,we love help coxiwdile,1
501,would love win deo faaaaaabulous xx,1
502,yes john,1
503,thanks no worry ill navigate blog check,1
504,thnks progrmr,1
505,bet well wont getting sleep pm shift quit hard work but thank xx,1
506,hardly surprising rose inspire much emotive poetry,1
507,joined program,1
508,always end breaking apologizing shouldnt fuck nice,1
509,fabulous well hope great day kb,1
510,hi would like concert let know city country ill start working thanks,1
511,youre welcome,1
512,visit blog couzoaqrowkx thanks,1
513,did enjoy share experience,1
514,follow corcvcyyoiq follow back,1
515,luv ur,1
516,past hoodie cover lot sin,1
517,bet excited xxxxxxx good luck hope get number one,1
518,youre welcome jim made chuckle train morning happy friday,1
519,shopping bit,1
520,agreed haha,1
521,happy birthday were positive full cake,1
522,doh subscriber needed please let know reached number,1
523,im good thanks hope well xx,1
524,dry hot scorching summer,1
525,maybe younger woman stamen tom,1
526,thing arent looking great either expect anything le lol at least weekend,1
527,finally get bed good night tweeties,1
528,thanks guy,1
529,fab thank support,1
530,really dont love much,1
531,follow loner side please,1
532,this coaqyxuxuv,1
533,introducing new word altering understanding word spreading either the big problem,1
534,follow corcvcyyoiq follow back,1
535,wooftastic twoofs hope supa dupa weekend cofiyprtai,1
536,near enough dartmoor,1
537,im gon na stay gold colour hopefully come soon thank anyway,1
538,follow back,1
539,yay ok,1
540,someday well know,1
541,dii cant forget si,1
542,jgh fr smf ft my girl,1
543,maybe get japanese import hello kitty matching stationary,1
544,the weekend drawing close what plan coagrhf,1
545,hi saw follow thought might like dark coaloxwsqdjh plz let know think,1
546,and hello twitter my account is broken again,1
547,hi thanks connecting we specialise thermal imaging survey need,1
548,please follow back,1
549,hi want get connected planning come south korea,1
550,oh fact,1
551,id planned nice scamper slept alarm for two hour suppose needed sleep aint mad,1
552,chweina xd jotzh dude go school dont waste time twitter,1
553,hiya yep show take place completely cover worth bringing coat beforehand tho foh outside,1
554,enjoy holiday,1
555,havent seen many menacing since finished jojo,1
556,thank always at last im back track hope fantastic weekend cofukonlom,1
557,make better though,1
558,stats day arrived new follower no unfollowers via coealsenng,1
559,follow corcvcyyoiq follow back,1
560,go guy hope enjoyed update byeadmin lukris,1
561,have lovely day yes stay happy cohaimzadnht,1
562,what day,1
563,happy birthday momma bear love much redid found last picture th grade cookxirapwxh,1
564,ill text tomorrow,1
565,love cozrvlbkl,1
566,nice line,1
567,playing ball atm,1
568,appreciate recent retweets have great friday,1
569,follow corcvcyyoiq follow back,1
570,building product like packing suitcase plan think need then remove half fully agree,1
571,hang copying translation dostoevsky note,1
572,voucher new bugatti whats value,1
573,someone love promise,1
574,know bra know bra get,1
575,yummy ala bdayt season mnwreeen,1
576,listen jazz truck,1
577,hi bam can follow bestfriend she love lot see warsaw love,1
578,cant wait speak see,1
579,waiting hq pic today add yoona hairpin otp collection cocggzwdmdg,1
580,paindo dont want say,1
581,awesome await report,1
582,throwback lol manny still asshole,1
583,story structure unit encompasses bhk flat cojlbgigll,1
584,you know like,1
585,follow corcvcyyoiq follow back,1
586,it curry they close home,1
587,the clash milano calling,1
588,followback po,1
589,legit loser sit get gassed,1
590,all friend hi saw dead thing made think aww thanks guy,1
591,can please get follow you awesome,1
592,awwww thanks,1
593,thanks news man utc,1
594,remember one time didnt go flumekaytranadaalunageorge even though ticket still want km,1
595,oh good haha let know think,1
596,thanks give certainty problem hope could solve fasterat least know dont hurry totem,1
597,off somewhere later,1
