,Sentence,Class
2299,to student around globe we miss you enjoy summer well see soon,1
2300,happy birthday hajur,1
2301,yayy thanks,1
2302,wow so much hate came way speaking truth mustve hit nerve keep speaking,1
2303,prelim exam tomorrow codfaxaazg,1
2304,well made week nwb officially today now wait till monday start long road walking,1
2305,cokmhdqciwdm mary,1
2306,how every day shud begin cokjafqoswq,1
2307,that cold,1
2308,in glad lasted one day,1
2309,you girl hmu sometime,1
2310,no worry thanks follow we hope great day long till weekend,1
2311,love wow picked cala brush day,1
2312,sometimes choosing ego relationship,1
2313,wherever ill always make smile,1
2314,sooooooooo happy grade,1
2315,really like interaction how sunny offer help dongsaeng chorong and friendship among idol,1
2316,thanks ffs,1
2317,many thanks via,1
2318,most impressive now dont feel bad copcgy,1
2319,many thanks,1
2320,awww going ask dragon duck mix cheetah,1
2321,wagga wagga for phase coursework coming at you,1
2322,no problem lorna,1
2323,just bit big scan add pile eye oil canvas pad cosedkslbzph,1
2324,happy birthday iqbal wish you all the best,1
2325,ima leave right covlgobizvhd,1
2326,nice knowing,1
2327,likewise ur hon,1
2328,friend hahaha,1
2329,im playing brain dot coylkmksabv codwfufpcfrb,1
2330,great work matt,1
2331,that thanks bro everything,1
2332,aja besi chati phulani swasa bahari jiba but congrats keep spreading smile like always tweet,1
2333,mumbai gujarat rain distrubed collection otherwise bb week cr inspite bb highest record holder till,1
2334,lol whole family threatens daily basis,1
2335,happy friday everyone dont let rain get escape beach need today,1
2336,ok good hear keep,1
2337,pamper day great cut angelo justin quezon city copwvwqxgc,1
2338,ive got ta go home put sweatpants hold breath die,1
2339,lovely guy isnt look like james bond,1
2340,happy tripping farbridges,1
2341,smile like mean,1
2342,the nixus adventure begun time make flint tool haha,1
2343,hi see like fourfiveseconds think might like deaf ear cohqzosdk plz let know think,1
2344,pick me please cosovadwnbd,1
2345,haha thank,1
2346,oh right thats good idea instead separately,1
2347,he attacked criticised every gesture word pedal stroke one must attentive notice little thing,1
2348,thank you cohksvbfh,1
2349,deposit secure one,1
2350,travel style,1
2351,dont know helped get awake shock spilled coffe rest coffe,1
2352,happy birthday chocolate lover cake tenerina auguri italy best wish coaknaojdljj,1
2353,ohh hope till,1
2354,this sound nice,1
2355,vyapam received iso certification,1
2356,know exactly want get itme paralyzed anxiety sadnessme lol,1
2357,get coaadycdfb coaxugidwv,1
2358,yup got book far,1
2359,cool cotlyxmxej,1
2360,thanks sharing enjoy app wishing wicked weekend,1
2361,one direction,1
2362,visit blog couzoaqrowkx thanks,1
2363,youre welcome,1
2364,follow follow back mention,1
2365,hey itd great share blog started writing blog check let know hows coggsbbh,1
2366,finished development testing spain next official test who excited season cofxqpbmh,1
2367,want make someone happy thats def happiness,1
2368,hi bam can follow bestfriend she love lot see warsaw love,1
2369,that awkward moment feel got ab because cant stop laughing reading tweet,1
2370,galing ni founder loveyaaaah,1
2371,if dont dont get just follow link find code copavkszuwu enjoy tom,1
2372,gn love see day,1
2373,thank lovely specialist breathing people,1
2374,done bb aw sweet thank babyyy,1
2375,fav dm,1
2376,please follback love ur voice hehehehe,1
2377,it always amazes people forget drink water drink water people,1
2378,re cap show start uk time today codgwjizdlp featuring yall,1
2379,thank oppa,1
2380,same sunny,1
2381,see flickr pro back,1
2382,if see bot,1
2383,hhahahahaha just blew upp entire the la vega strip fuck youuuuuuu vega hahahahahhaha,1
2384,wishing happy friday xxx,1
2385,thanks retweets cool weekend,1
2386,probs still wondering around callies bc poor puppy terrible owner,1
2387,look made final design hope like coextyqb,1
2388,and number two week done gorefiend mythic live coqdjgfjy,1
2389,you rock thank much mention,1
2390,ok your reminder set reply want change time,1
2391,have hour,1
2392,bea miller lockscreenrtfav want itmbf dm keesh coehpsfooyj,1
2393,yesterday groupie bebe sizams coyempfvi,1
2394,would love gift my si blue kurta blue her fav color coyvhhgmzx,1
2395,thanks following you welcome,1
2396,thanks happy connect,1
2397,dont stupid head needed urgently pls apply within,1
2398,id like,1
2399,kindly check email were done sending invoice since kanina pong umaga,1
2400,hey jay what browser typically use mary,1
2401,follow back pleasse,1
2402,thank making dream come true saturday sushi cobbmaflxd,1
2403,leeteuk oppa miss you my,1
2404,pearl thusi cohqiyijios,1
2405,thats get pouring milk first,1
2406,you get tgv paris austerlitz blois mile away chateau de marais get taxi,1
2407,read today im excited,1
2408,hello yaya,1
2409,hi bam can follow bestfriend she love lot see warsaw love,1
2410,hmmmm delicious chicken curry friday thanks noms covvmvffoja,1
2411,nice enji good job,1
2412,dear hater cobxqzpmxgr,1
2413,hi enter purchase specially marked first choice custard pack enter via sm pack instruction good luck,1
2414,thats best one,1
2415,our tile nice green boring love original glass door guy downstairs cofxgpkhnic,1
2416,we couldnt said better kelly so glad youre enjoying nibble,1
2417,visit greek ruin petra when back,1
2418,shadowplaylouis recently got mutual im really loving tweet everything yay thats exciting,1
2419,hey camera cuz everytime look smile coghehgxij,1
2420,woohoo welcome aboard lani great grazing,1
2421,ah look fab pride place cokbsyqywkef,1
2422,well apparently im sleeping seeing already starting get light ha ha ha,1
2423,thank follow,1
2424,hi dave please contact app support chat ensure get time,1
2425,wa first item edit list,1
2426,well screw guy keep smiling,1
2427,youre welcome amber hope youre enjoying,1
2428,thank several step appreciate noticing,1
2429,they didnt deserve shit,1
2430,morning thank rts,1
2431,exciting news day till hpc party,1
2432,drew codgiqiora,1
2433,thank following,1
2434,interview newsround news hound today,1
2435,thank ada long time see,1
2436,we know racist called hulk,1
2437,sleep tight world say prayer,1
2438,phl abu dhabi love blessing hihihi coayimbaitd,1
2439,msg play fantasy maybe get league,1
2440,settle main air dkt porch,1
2441,download uber mobile application place order,1
2442,hi would like concert let know city country ill start working thanks,1
2443,sun shining im gon na make,1
2444,thankyou coytvapvo,1
2445,welcome family sending laughter giggle way coyltydahatj cohuiebsvzk,1
2446,thank happy knew,1
2447,and forget earth delight feel bare foot wind long play hair kahlil gibran,1
2448,the flash all day long,1
2449,sound fun,1
2450,think good old stiff upper lip reason called great britain,1
2451,latmon cobycjffasg coitjnmwdjf,1
2452,im good,1
2453,ill stay dry would end pain,1
2454,thank follow,1
2455,might worthwhile endeavour excuse weekend away,1
2456,well good luck anne you always go indie route joy,1
2457,day everyone experience exploit window everyone get new computer,1
2458,ign ign au pubcast the hero we deserve tengaman tuesday july celebratio cokbdsvnnnl,1
2459,need something tuesday ive got whole day,1
2460,learn spell,1
2461,wow thanks donna determined get woman cycling amazing changed life,1
2462,follow back pleasse,1
2463,all set we wait notification install window pc mm,1
2464,glorify infirmity realizing silly make realize suave gentleman god,1
2465,in news im mile hitting monthly mileage target week go yet,1
2466,want iphone so could facetime people take nice picture cuz samsung quality suck,1
2467,thanks sharing,1
2468,ey youve got message beth,1
2469,watched shes dating gangster nd time realized something love athena style,1
2470,current playlist copykqldkhr,1
2471,more look rather fancy right,1
2472,bye wellington youve awesome hope meet compivkggr,1
2473,fellow woman proud moment wan na rich move,1
2474,keep eye peeled soon christina have signed newsletter most offer go first,1
2475,thanks zy let friend yaa,1
2476,you welcome hope help,1
2477,doesnt olur,1
2478,say hi,1
2479,new video people check,1
2480,thanks following,1
2481,hi bam can follow bestfriend she love lot see warsaw love,1
2482,hello get youth job opportunity follow,1
2483,can please get follow,1
2484,see soon thing,1
2485,it flawless remix,1
2486,thank guy really happy see many good reaction make wan na draw,1
2487,yes dad coedjdmzfx,1
2488,thanks bro,1
2489,omg im sooo jealous,1
2490,thank wonderful feedback sir we hope see soon,1
2491,hmm gold,1
2492,everyone stay life dear,1
2493,damn cute,1
2494,goodnight hayli,1
2495,look arrived today super thanks edwin elvena emc much appreciated,1
2496,great watching fellow fan,1
2497,it never bad time bath rubber duck,1
2498,ive sent email full swearword,1
2499,pixars inside out today asked member whats favourite subject brain coqezet,1
2500,ill take infection,1
2501,lol right wrote,1
2502,im dead thank,1
2503,haha guess im video game nerd like christophe gans film though check brotherhood wolf,1
2504,interest speaking ever,1
2505,sleeping pill ive nocturnal past couple day,1
2506,stats week arrived new follower no unfollowers via coeqarytyk,1
2507,special offer rrp price,1
2508,lol read article first,1
2509,thanks million keeping eye tweet always appreciated colicjpzzk,1
2510,jah wobble band tour date coswlppeevq,1
2511,shout out to me for being retard,1
2512,waking coruhqcygay,1
2513,eye check corhcicurvg,1
2514,like pun cojptwxgctg,1
2515,youre part elite group,1
2516,camillus pleaseee,1
2517,the reason would hand back spare tyre boot otherwise true star,1
2518,cheer realised werent joking,1
2519,morning msg love air coosbykav,1
2520,quote tweet dm really want ill surprise,1
2521,ahahah ill,1
2522,thats shame thought getting somewhere abandoning talk disagree get nowhere,1
2523,contradict continuously create chaos contained cranium,1
2524,sneaker day coktdxxnyd,1
2525,happy friday do exciting plan weekend there winter ball falklands,1
2526,me cant wait,1
2527,haha thank,1
2528,no problem ill answer dm soon thanks jamie lee,1
2529,be sure check last edit havent already contqrwpi,1
2530,congraaats guy,1
2531,what event,1
2532,use chrome,1
2533,thank im glad part,1
2534,hope great success waiting released korea,1
2535,good morning and happy birthday have good one,1
2536,late night storm thunderstorm could put sleep every night,1
2537,made la vega hotel,1
2538,congrats omgg good job today race thankie good job tdy race cocecwmha,1
2539,hi made final design please check coextyqb,1
2540,love you so much ma,1
2541,good going peter keep,1
2542,the mega power expelled,1
2543,boughy ex kernel manager love old version new one even better coxgmauzcyyf,1
2544,love second fall asleep back fall sleep paralysis,1
2545,love liza,1
2546,lol hook,1
2547,omg cant believe the vampire diary followed thank much best day ever,1
2548,twice daily,1
2549,thanq gooday,1
2550,found goodwill gold today,1
2551,wonderful question workshop coddpkakz ill also send info later today,1
2552,thanks ash,1
2553,so debatable,1
2554,seed beat seed solar shown thank cojpwuuzik,1
2555,ek who want so,1
2556,love much,1
2557,an human like eat many taco mexico the taco best thing country viva mxico,1
2558,best burger far agree colejakjrj,1
2559,let take lighter shall cotfbtbrh,1
2560,sweet tooth couagbiaxs,1
2561,morning it bacon roll friday,1
2562,be patient korean netizen crueler thought,1
2563,thank best wish,1
2564,elephant also enjoy taste unique marula fruit,1
2565,we shoutouts shortly covcddhzqvv,1
2566,when one japan pop artist become one follower ig nice,1
2567,getting need homework probs upload tomorrow seeing time,1
2568,hi marco fruit herb park view hope youll appreciate eye thanks,1
2569,actually gon na start pm,1
2570,low self esteem dont know,1
2571,patience something dont still,1
2572,hahaha hope,1
2573,favorite account cute aww thanks making account,1
2574,im giving coworker four minute call,1
2575,hey lot write deathly hallows supernatural go cochjaqugbw,1
2576,definitely good news consultant,1
2577,anytime anytime,1
2578,nope up himachal,1
2579,stats day arrived new follower no unfollowers via cottnczjr,1
2580,nothing ashamed dude youve started,1
2581,lol omg duh well go win money,1
2582,good lucky dont care,1
2583,oh charge buyer inform joined contest,1
2584,finished downloading movie one complete tv series last night now where do start,1
2585,happy birthday,1
2586,especially conversational skill suck,1
2587,keep face sun never see shadow,1
2588,never fan never owned pair if im gon na wear typical coloured shoe itll cortezsuperstars,1
2589,many tthanks colin,1
2590,hello we offer internship luxuous hotel worldwide sure youll find one coydqkrcvdd,1
2591,sure babe,1
2592,look forward watching,1
2593,were glad discovered let know question,1
2594,pleasure tarryn shot listening,1
2595,human basically dont want peace calm otherwise would spreading practicing science goodness,1
2596,hello ate,1
2597,youd answer course understand completely would like,1
2598,see yah sunday couswzgsjxl,1
2599,hey here invite join scope influencer corrifssek,1
2600,yeeeeyyy congrats,1
2601,great thanks lovely almost response first hour so delighted some really great comment next,1
2602,brilliant article independent sum current labour leadership debacle perfectly enjoy,1
2603,thats awesome other people take much longer,1
2604,it nice talking someone using,1
2605,hi bam can follow bestfriend she love lot see warsaw love,1
2606,add snapchat amyjackson cocgyxtuoirt,1
2607,downloading new song,1
2608,got five night freddys demo getting ready record im super pumped im fnaf fanboy,1
2609,off cycling,1
2610,first impression,1
2611,hoping grand sidni remarriage occasion year completion congratulation,1
2612,five night freddys night coclyoptuag,1
2613,follow quote,1
2614,people still code language but youre right for java guy phps notion reference equally confusing,1
2615,met amy ohioan stick together,1
2616,sitting hour still doctor sitting hospital doctor,1
2617,just let know best address,1
2618,my app looking influencers if youre interested here invite corzgztqfjt,1
2619,thanks following enjoy tweet let friend ambre suzan,1
2620,looking offline game guide weve got covered cohrnfhroj,1
2621,cmon ur turn one time let just tweet,1
2622,thanks following enjoy tweet let friend beverly martin,1
2623,mb needed coffee,1
2624,thanks youre kind good look power kinda meaningless,1
2625,common celebrate never fails get good mood,1
2626,trying face paint show cotsgnewas,1
2627,thanks following enjoy tweet let friend gtagiveaway,1
2628,nice see emulation brought,1
2629,indeed may email bit info,1
2630,well idea,1
2631,some guy saying dont omegleyou could use google thats im,1
2632,lil bro corner,1
2633,so enemy simply go around coplhst,1
2634,thank beiruting cobplvwrgpu,1
2635,ive crazy great day today so glad relax tonight though,1
2636,thanks eric mention ou may wanted considering,1
2637,why painted nail pink,1
2638,omg cant tell dont say cant wait know,1
2639,idea cc,1
2640,this earth cogrhjwbdkvk,1
2641,well least itll refreshing,1
2642,care haha,1
2643,meoooowwwwwolf wolf wolf barkkkkkkkiiideee bark,1
2644,hi bam can follow bestfriend she love lot see warsaw love,1
2645,routine great long enjoy view end coyqkccykq thanks favourite,1
2646,oh cool hope like,1
2647,thanks bro,1
2648,drew aleks,1
2649,find know haha cozwndmvboed,1
2650,awh good luck upgrading,1
2651,kumpul cantik ganteng kresna jelly others simon son pic connxwylxz,1
2652,thanks lesley lovely see have fun france coqtargybqy,1
2653,here life lesson teach kid weekend coxdkilwuy,1
2654,thanks helen keep touch ever want filming blood service know,1
2655,stats day arrived new follower no unfollowers via coqzpcla,1
2656,great stuff,1
2657,oops we see panty couekfhyo cowrwijfnfki,1
2658,lion japanese landscape made artworkbylie cotjcyarea,1
2659,finished presentation thank,1
2660,really wan na watch daredevil episode daredevil watch despondently watch old eps,1
2661,welcoma nice day,1
2662,favor tridon cause he tank,1
2663,stats day arrived new follower no unfollowers via comqqlygjs,1
2664,save pic master nim say therere pic so asked many pic see,1
2665,kebun adorable spot ubud waiting better place xoxoxo codfkzkrkizz,1
2666,always felt way life beginning cozpdxqlnvj,1
2667,sneak peek item august collection stay tuned inbox order price colyocjyh,1
2668,bc really dont feel like reading coopmjkjo,1
2669,thanks peep,1
2670,happy long time,1
2671,therealgolden thanks follow hope enjoy work cogsxinbnl,1
2672,morning all thanks joining happy friday,1
2673,lol hilarious coiubeqmixp,1
2674,big thanks everyone couldnt done without support,1
2675,always forget tag ppl,1
2676,probably yes,1
2677,how nice convo like normal person instead posting feel closest twitter friend,1
2678,hope ull njoy followingg,1
2679,im active im near making account private,1
2680,close eye,1
2681,thats one mine button pusher out soon,1
2682,thank much were glad enjoyed,1
2683,thank pri,1
2684,im gon na freak,1
2685,second simply stunning coeqmgetz,1
2686,omg cant wait miss everyone wooohooo coiiqaaas,1
2687,hello cutie,1
2688,sure go cuss teenage girl post video im sure feedback amazing,1
2689,have great session hope youve got,1
2690,first meeting three today ace way end week coidzifkge,1
2691,morning everyone lovely day fab weekend,1
2692,belated happy bday sauce coaeqelimc,1
2693,hi livi fowles oliviafowles do want get free iphone hurry check bi thx coxhlszudxr,1
2694,followed ya cogktqxsdpb,1
2695,burnout cogvyfofnx,1
2696,great read matthew really interesting thought provoking,1
2697,is indiankulture oppose happy anniversary,1
2698,please give thanks,1
2699,happy friday biker babe,1
2700,ya dis sound lyk gud idea,1
2701,ohhh find cojrmergv,1
2702,oh course gained weight bcus used rubbish veggie ive learned balance everything,1
2703,can steph come back nj,1
2704,hi bam can follow bestfriend she love lot see warsaw love,1
2705,wonderful day thank,1
2706,twitter allowing retweet blog post since thought youd interested link feed,1
2707,youre welcome thanks exploring retweeting,1
2708,smart boy,1
2709,cheer xx,1
2710,aa soon get listenablecohesive point let meet be great get feedback,1
2711,seems like people use men source nothing new guess just gossip,1
2712,hi alex heswifi do want get free iphone hurry check bi thx couaajjisnlk,1
2713,got mine done morning,1
2714,looking forward,1
2715,wub cerbchan,1
2716,hi jarraaaaa do want get free iphone hurry check bi thx comgapqcxpgj,1
2717,morrrrning snoozed go home today,1
2718,clicksco thanks,1
2719,it better gay lesbian rigid theocratic right wing fundamentalist islamist,1
2720,thanks feedback ill take next tuesday,1
2721,hi brianaaaa brianazabrocki do want get free iphone hurry check bi thx coibswpyw,1
2722,last night sky cofqdqhqwu,1
2723,well said right episode fantastic clap clap clap,1
2724,awesome glad working always need mka,1
2725,did get offer play film turn cause summer body wasnt ready yet,1
2726,the mega power expelled,1
2727,thanks retweet friend,1
2728,hi would like concert let know city country ill start working thanks,1
2729,think everyone codxxsxyek,1
2730,dy whilst hugging aki yaaay,1
2731,looking fun kik thencerest copdvqwqaqq,1
2732,oh cool worked cheer,1
2733,snapchat sexyjudy coaakphtge,1
2734,love song,1
2735,great end work week sunshine low humidity change weekend detail am,1
2736,birthday today how promotional cake swear walk nail,1
2737,always seemed like sloppy second,1
2738,hi stock marmite cheese spread thanks,1
2739,hi bam can follow bestfriend she love lot see warsaw love,1
2740,indeed wonderful see everyone great night,1
2741,okay start,1
2742,thank nic hang soon sa taft ahh,1
2743,thank much helping spread word finalist national lottery award,1
2744,someone mention usagi loooooove,1
2745,wowwww thanks lot team via,1
2746,let be friend,1
2747,lepas dah sembuh ni sibuk balik okay la kin you wont thinking anything else except ur study,1
2748,sneak peek cowkwsmxvow,1
2749,thanks alex,1
2750,mine cojdumaxgzh,1
2751,soo hot sun smiling lol,1
2752,fuck texting funny dudesdudettes cost im,1
2753,thanks ah coykotrm,1
2754,wowwww thanks lot team,1
2755,hey thanks for following cochhwqdhgo via coxmohgowivj,1
2756,geer bat mz yang deennya jehwan,1
2757,thank glad enjoyed,1
2758,good morning look forward seeing soon have good day coqdohahes,1
2759,hey thanks for following cochhwqdhgo via coxmohgowivj,1
2760,good weekend,1
2761,short stream tomorrow am fun day today thanks,1
2762,hi julie not bad thanks,1
2763,hey thanks for following cochhwqdhgo via coxmohgowivj,1
2764,so calumsos lukesos ashtonsos hey guy please follow chelny,1
2765,im datz,1
2766,goodnight jeremy,1
2767,big hello weve sent email,1
2768,thanks friend wonderful friday,1
2769,cant sleep fmt dat dm,1
2770,also dont know tweet,1
2771,hahahahaha law make happen would heartbeat,1
2772,already clutching shit foh homie,1
2773,what great idea cohoozhlqc,1
2774,like cokplkapqgo,1
2775,hi please check final design coextyqb,1
2776,visit blog couzoaqrowkx thanks,1
2777,going see tonight son choice film glad hear worth watching,1
2778,hate life much lmao,1
2779,angel must confused another doctor,1
2780,relevant want puke,1
2781,just make sure rubber duck it proper bath without,1
2782,hi bam can follow bestfriend she love lot see warsaw love,1
2783,this one irresistible cojocecxir,1
2784,so long subliminal message cotkdveyqfbo,1
2785,nice one mr lewis,1
2786,everytime look clock something weird happens finished coughing blood started nice,1
2787,hi thanks connecting we specialise thermal imaging survey need,1
2788,haha thank,1
2789,im muslim love prophet coeelrfzulc,1
2790,we would anyway,1
2791,stop getting hate whatever kind he made mistake understood stop,1
2792,thanks retweet,1
2793,going question politician im going argue man intellect,1
2794,woah big plan good luck,1
2795,thanks recommendation shiva we happy music mp mobile apps copnohlxnvv coinircaptp,1
2796,summer join fish chip sandcastle fun coklojtjnn,1
2797,more like ewok case,1
2798,id want nate win brawl rear naked choke th,1
2799,glad liked,1
2800,coffee not bad either codxwlgjm,1
2801,also catch heck lot gun hater try associate gun um endowment rude response,1
2802,agree sarah phone really busy time this give option,1
2803,thanks playing,1
2804,had one best conversation ai today pleasure meeting sir conibabzskel,1
2805,my name sikandar khan and support,1
2806,the starbucks logo stand obsession addiction death,1
2807,keep smiling perhaps smile renew hope someone who lose smiling charity,1
2808,hello tell still keep touch zayn,1
2809,have blessed friday,1
2810,just smile enjoy time,1
2811,min follback,1
2812,go hokies our biz internship posted university recruiting non tech website ill dm info,1
2813,hello america california usa dear friend thank following,1
2814,it july am mean time give love mistgameplay,1
2815,hahaha bailey may such fan boy of ariana grande,1
2816,we nex vex designed cownmvaadry,1
2817,good morning igers cojdgtfbvve coyqrrzu,1
2818,dudeeeeeee im happy like tell favorite,1
2819,yes that keep coming list someone else mentioned persona ill try thanks,1
2820,yepp course mo,1
2821,let play comjrbzhkoa,1
2822,thank much,1
2823,invite my pin,1
2824,playing dota,1
2825,hi bam can follow bestfriend she love lot see warsaw love,1
2826,glad agree greg think theyre pretty useful mka,1
2827,come australia love posey,1
2828,ah ok wondering,1
2829,yeah nothing stop king france have nice day,1
2830,going miami tomorrow,1
2831,fab hope youre,1
2832,jamesyammouni hey james thanks follow please follow chelny,1
2833,thanks retweet friend,1
2834,thank much,1
2835,appreciate glad friend,1
2836,time for mine,1
2837,have full breakdown material used thorin time hunt material work project,1
2838,love lot xx,1
2839,tired yesterday choroo ga nahi ko,1
2840,cheer mike love pic,1
2841,aztec princess,1
2842,nice rainy walk work stopped look rain river saw kingfisher,1
2843,or ask he made year coydlzrwyrl,1
2844,so lovely relaxed face least,1
2845,chinua achebe to intellectual doesnt mean knowing intellectual issue mean taking pleasure,1
2846,the amber liquid continues flow almost game time cotjsukevepd,1
2847,harry dm giveaway nooow,1
2848,stats day arrived new follower no unfollowers via couimhgcmidk,1
2849,let cojknpwfdqkqhelp get book published ebook print let help launch self publisher let,1
2850,study mcdo strong selfie game everywhere,1
2851,hey iphone dreamer tanishanonly wan na get iphne free checkout bi thanks coixfxjiyj,1
2852,often attitude kindled flame others conviction louis le bar,1
2853,good reason hope,1
2854,well this worth repath repath kak adis pic coxaeeetfdi,1
2855,im stefanie this real one,1
2856,no thats completely true im watching entire series sg right lightbox confirm,1
2857,indeed ran character knew youd get cokflhkqfwho,1
2858,hand incorrect spelling im apologist,1
2859,hi bam can follow bestfriend she love lot see warsaw love,1
2860,add coxafrmeio,1
2861,oh okay thanks,1
2862,no vuly today tomorrow though,1
2863,boat trip beautiful wife cobdgladgi,1
2864,it july am mean time give love mistgameplay,1
2865,tom via snapchat comxoocyhb,1
2866,hey cam we come peace what help,1
2867,stats day arrived new follower no unfollowers via coxxkfaylk,1
2868,dont want ruin dream thinking youre batman,1
2869,stats week arrived new follower no unfollowers via comfsvecwbw,1
2870,cute she look fabulous,1
2871,yes pearson reputation doe nikkei reputation hmmm ask michael woodford,1
2872,cousin life cojwnwlup,1
2873,yaap urwelc,1
2874,neon color hot pant,1
2875,haaa would miss,1
2876,everyone want parcel everyone willing believe auspost failed deliver,1
2877,earth coxqsufdwtl,1
