,Sentence,Class
4555,hi im seeing workplace one venue list im sure fix thanks,1
4556,oh wow thank skin going perfect time head lagos codiloywmj,1
4557,wow luxord look really amazing new kingdom heart promo art coffjurljpc,1
4558,new potato garden hundred dig,1
4559,thank have lovely weekend everyone coccpcllzic,1
4560,well totally blew mind morning cojjxcmypj,1
4561,of course now ive cited academic paper feel ive arrived,1
4562,life smile,1
4563,thanks info,1
4564,surely watch pokiri nenokkadine tym favs,1
4565,yang retweet,1
4566,who still awake,1
4567,it heritage sword made wood,1
4568,youre right thx andrew great day,1
4569,cool video love thank,1
4570,season set have nice friday comgayutmknz,1
4571,peasant seat watch peasant team dont mind ahahha,1
4572,chris thats great hear due time reminder indeed planned available distant future,1
4573,thanks shout it great aboard,1
4574,hey long time talk,1
4575,matt would say welcome to adulthood cozhqyiyacp,1
4576,could say egg face,1
4577,hopeless tmr,0
4578,everything kid section ikea cute shame im nearly month,0
4579,that heart sliding waste basket,0
4580,hate japanese call ban me,0
4581,dang starting next week work,0
4582,oh god baby face cofcwgvaki,0
4583,make smile,0
4584,work neighbour motor asked said hate update search coxvmtuikwln,0
4585,sialan cohvixcrl,0
4586,athabasca glacier codzzdqmfcz,0
4587,really good mg idea im never going meet,0
4588,mare ivan,0
4589,happy trip keep safe see soon,0
4590,im tired hahahah,0
4591,with knee replacement get day ouch,0
4592,relate sweet sour kind bi polar people life cuz life full,0
4593,im sure tho,0
4594,feel stupidi cant seem grasp basic digital painting nothing ive researching helping,0
4595,good lord conclkyuuvo,0
4596,feel lonely someone talk guy girl,0
4597,no assignment project really,0
4598,want play video gameswatch movie someone,0
4599,choreographing hard,0
4600,email link still say longer available coiuiaioynnx,0
4601,cry bc miss mingming much,0
4602,sorry coqtayjrqk,0
4603,mom far away,0
4604,were truly sorry safe flight,0
4605,oh hate happens get sad,0
4606,oh dog peed bag so cant take,0
4607,it suck much sick plan start work first gundam night nope,0
4608,my dollar cooipygusdi,0
4609,listening back old show know im weird just got leaving might give it pale imitation,0
4610,went sea massive fucking rash body painful thing ever want go home,0
4611,hi why absent,0
4612,my gran tho she knew didnt care tell,0
4613,same it so cute love it so much wish there would be sequel,0
4614,busy sa school next time love yah xx,0
4615,ouucchhh one wisdom teeth coming,0
4616,frightening case it really get,0
4617,pret wkwkw verfied active dont forget follow member thanks join goodbye,0
4618,youve got chain love sentir se incompleta,0
4619,didnt go wednesday,0
4620,marvellous how thwarting,0
4621,awh whats chance zante we need something,0
4622,whens birthday,0
4623,worst part still feel bad,0
4624,audraesar all sushi pic tl driving craaaazzyy,0
4625,really want cotsyimi,0
4626,popped like helium balloon,0
4627,california powerful influential air pollution watchdog califor coovupqwfh,0
4628,sad elhaida robbed jury came th televoting,0
4629,idaho restrict fishing despite regional drought linked die cojjbodolyz,0
4630,abrupt climate change may doomed mammoth megafauna sc cotavmcze,0
4631,australia dirtiest power station considers clean energy biomass coyeqabqtsl,0
4632,it aint easy green youre golf course california ulti colarxzts,0
4633,well sure work day mine,0
4634,im gon na miss sexy prexy,0
4635,miss kindergarten kid,0
4636,cant find book keep sane,0
4637,literally three lounge event so much turn im sad,0
4638,miss bos,0
4639,love hozier,0
4640,thats true want soooooooner,0
4641,ahh fam contmyngyd,0
4642,im sorry what hypercholesteloremia are ok,0
4643,baby still look tired,0
4644,can someone gift calibraska,0
4645,massive shame would actually genuine contender wont happen,0
4646,my head always hurt stay late lmao,0
4647,sound upset cojzbfbkldq,0
4648,so much miss copnhvgdnft,0
4649,miss infinite,0
4650,aos doesnt dont want stick th either,0
4651,much serious yun eh,0
4652,my room way hot,0
4653,still havent found handsome jack drawing,0
4654,but cut encore,0
4655,wish baymax,0
4656,french mixer miss much,0
4657,wft cant watch awesome replay cochzrqtelph,0
4658,party promotion,0
4659,music bank encore always short,0
4660,baby boy,0
4661,order received hub nearest doesnt look like delivered today,0
4662,why mum playing music loud,0
4663,the finale parasyte fucked feeling alllllll way,0
4664,good bye party era,0
4665,nathann never got chance take pic got hug tho pic next time see,0
4666,girl came like beautiful want dieididieieiei shes cute,0
4667,party goodbye stage mean hello lion heart you think,0
4668,tell screw im gon na netflix chill dis ervin,0
4669,ohh yeah hope come back soon,0
4670,ive accepted offer im desperate take year,0
4671,come back,0
4672,snapchat amargolonnard coslhafrsu,0
4673,ugh cant stream tmr have duty,0
4674,uve gone far,0
4675,what alien thing,0
4676,aww dont really wan na get hope wish would,0
4677,knew would sad funeral gon na text phone,0
4678,sunny feel bad cotcauhkp,0
4679,so nonexistent wowza,0
4680,back fah shes mine,0
4681,taylor crop,0
4682,boo count,0
4683,new guitar,0
4684,get jonghyun hyung please predict,0
4685,hope sj nominated soon sj infinite pls,0
4686,yeah dude keep calm brace coznojtvgq,0
4687,sir plus please,0
4688,they looked so shock omgggg yall deserve it,0
4689,whenever would spend night would smoke watch movie would always end falling asleep,0
4690,we point close grand final whyyy,0
4691,thats long time,0
4692,oh must annoying evan do text give option opt,0
4693,who giveaway muster good merchs,0
4694,ah bad,0
4695,people looking funny im drinking savanna straw,0
4696,good bye stage,0
4697,and why did you ignore me yester afternoon,0
4698,cant sleep someone talk,0
4699,yes sadly,0
4700,whens album coming,0
4701,the last chocolate consumed,0
4702,ugh werk morning,0
4703,foreals wesen uwesiti mj,0
4704,catch online long enough haha he annoying,0
4705,dying egg benny,0
4706,sometimes hate,0
4707,baby followback huhu,0
4708,one cute,0
4709,youre gon na watch shit understand badly scared coycguditqgx,0
4710,miss al katie zaz amy lot,0
4711,liked video cojcbiswdw more sub plz,0
4712,can make diary youre please,0
4713,dont read rehash website mushroomed good piece may exception reach one anyway,0
4714,yes vicky omg,0
4715,wtf like your lip still virgin omg mom get life youre hahah,0
4716,ninasty tsktsk oppa wont like call dick kawaii manly cocugtqq,0
4717,so lonely covmnnbkw,0
4718,cant go back sleep,0
4719,wan na go xbox netflix already comfy bed,0
4720,miss youu,0
4721,sigh feel bad girl,0
4722,lol love sweet potato fry,0
4723,guess yall ugly asf huh,0
4724,eish ive quit know lost twitter mojo shame dont know get back mara im sure help neh,0
4725,aww ive got fever,0
4726,poor bb,0
4727,im able go it association green councillor conference weekend,0
4728,my skype account order think hacked so contact im sorry im creating new one soon,0
4729,miss tweet spree oh,0
4730,yes na sholong reject proposal gee fly go gidi the way im pampered lagos ehn,0
4731,guess im arresting girlfriend,0
4732,he nice person idk anybody would say,0
4733,you know song disappears phone itunes ive lost dazed confused,0
4734,do think survived well find missing body fragment but wouldve nice,0
4735,im forced go,0
4736,horrible weather going work,0
4737,wish could change,0
4738,walao kb never show encore,0
4739,sending finally,0
4740,being ill worst,0
4741,hope found safe well many fun time gig absolute legend,0
4742,yeah like need wait till saturday give homework pa what if made plan da weekend,0
4743,greek tragedy cute song,0
4744,raining today gym,0
4745,whats wrong,0
4746,oh god im strucked pain cant take anymore,0
4747,come belgium,0
4748,fabian delph fallen,0
4749,where been hiding baby,0
4750,im draking silently cant hear,0
4751,rest peace mo,0
4752,much chance game tonight,0
4753,ahhh see wouldnt wake,0
4754,mumma im,0
4755,im gon na dead tomorrow,0
4756,ill high low,0
4757,sad pray,0
4758,im still awake,0
4759,woke upp cant sleep,0
4760,no one help,0
4761,dont know happy,0
4762,hi dm luke please,0
4763,hey babe came across pic cant read hindi,0
4764,think bc im running space tbh,0
4765,wish could come see disability pension ptsd make impossible physically financially,0
4766,why rain,0
4767,nooo broke they soo amazing togheter,0
4768,suck mean watch play around time,0
4769,dont like cogawfbsra,0
4770,you cant hold another week september st,0
4771,cut encore wan na see snsd infinite interaction,0
4772,miss watching anna akana video,0
4773,askip texistes pa,0
4774,sadly channel owner decides region broadcast thanks kei please rate se coezfehmtts,0
4775,dont think ever notice still exist,0
4776,the traffic terrible,0
4777,ive eyeing small kate spade bag pero walang maganda,0
4778,haha aw miss havent seen age,0
4779,add snapchat corinehurleigh cobkptaqar,0
4780,bum zara trouser,0
4781,all sushi pic tl driving craaaazzyy,0
4782,my effect spanish,0
4783,aww poor thing hope itokay good health luckely freed rock cotoszmoafv,0
4784,first tried coxtszpifqw result,0
4785,want brace back,0
4786,need big cuddle lew kiss face dont want go,0
4787,em haha,0
4788,craving banana crumble mcflurry fry,0
4789,were going cable car brother got scared doesnt want,0
4790,miss hello venus old concept tbh rly like want tea,0
4791,weve lost album broadcast point coqdsvsqsr,0
4792,awful appointment tomorrow id like feel ok going since wont,0
4793,this suck want go home,0
4794,there milk left cereal,0
4795,huh yes,0
4796,lost album broadcast,0
4797,so sad cofvvywxo via,0
4798,yeah tried film date start at time filming day left,0
4799,get one think previous one,0
4800,cant smile,0
4801,im following user arent following back,0
4802,seems everywhere today,0
4803,fansign take photo expensive,0
4804,zzzzzz please dont let sun come yet,0
4805,when bffs extremely stressed cant anything pray,0
4806,ahh win goodbye stage,0
4807,true deosnt help liverpool last week never pool though,0
4808,yes bro lost many,0
4809,praying so sorry happened,0
4810,great news thanks letting know we hope good weekend,0
4811,my self esteem lowest,0
4812,feel look better people cant see tbhthey look tacky,0
4813,taken say,0
4814,man got lucky charm,0
4815,syria continues develop chemical weapon official tell wsj wsj rep cocprchkqw,0
4816,want bts merchs,0
4817,only one day,0
4818,should taken pic mr wong confiscated art work,0
4819,guy omg,0
4820,hadnt thought icepack big dos pain killer board but feeling painful already whimper,0
4821,say man fan,0
4822,wish could say final goodbye,0
4823,will senpai look buttsex,0
4824,but joking headline so arent friend pls dnt brk heart,0
4825,when someone hit head voice im like would sound amazing could but falsetto,0
4826,notice me,0
4827,hate time zone,0
4828,my snapchat leanneriner cotyhwgng,0
4829,aired spain the delay killing,0
4830,single untruth,0
4831,my last cross country ij amazing cant bear leave covkvoxiaeqn,0
4832,cant drive,0
4833,little apartment like someone come live,0
4834,soshi didnt win buttt congrats infinite,0
4835,im working saturday sunday friday bad day,0
4836,going home soon,0
4837,shoulda moved away boy chance cause theyre people want time like,0
4838,heyyyyy wanted see yeols solo danceeeeee,0
4839,inter offer nemanja vidic rom dont want either coksdgyltpf cofplkjpxnqn,0
4840,my mom linguist my dad computer scientist and dumbest one family,0
4841,broken really wanted morning ice cream pouring rain coywaxvqkpg,0
4842,would ever consider creating crash course video computer science there arent many resource school,0
4843,ice cream vehicle busy,0
4844,ate ayex eat youre sexy swear eat lot no chill lamon haha cocfoxwwljz,0
4845,this weather scrolling contact people ive curved hey sigh,0
4846,ill getting cement cast tomorrow,0
4847,sign coyqgajj,0
4848,bot if follow plz send mention because cant notice,0
4849,jmu camp tease bc wan na,0
4850,thats one sweetest thing ive ever said awuna mbulelo,0
4851,this fucking bad link isnt working cant watch match,0
4852,oh mr pig turning although there weird crackling noise plug coming plug im thinking fuse,0
4853,dammit tipped carlton,0
4854,go bed,0
4855,am want go alexs house,0
4856,true this part motorsport series one disc,0
4857,all want right followed cheeky instead ive got seo nls getting,0
4858,sure sorry,0
4859,hey bud christy really sick cant leave home xo thanks man,0
4860,my niece better summer,0
4861,wanted bloody sandwhich,0
4862,buset cohqyfkniz,0
4863,five thing learned pregnancy discrimination today left foot coeymmasmsd,0
4864,maternity discrimination when needed bos kicked teeth cowtyymnwz,0
4865,proposed new law will help domestic violence victim fm victim coeoismrzlpo,0
4866,missed okay lol nothing,0
4867,exactly unfortunately,0
4868,such stressful upsetting day yesterday uk government suck,0
4869,ugh well could still say im lucky sapiosexual,0
4870,aww bad,0
4871,ive trying play damn beta like hour,0
4872,dont want world hulk hogan scrubbed wwe history,0
4873,im tired,0
4874,this weather isnt making want go gym,0
4875,link doesnt work,0
4876,irene seemed sad making mistake,0
4877,naa unfortunately didnt phone,0
4878,it sold out,0
4879,valentine et al found rships btwn homobiphobic comment certain discipline incl european langs lit education,0
4880,notice im hopeless,0
4881,dream gettin realistic liking thx cant tell whats real isnt,0
4882,either would prefer benzema we wont get though,0
4883,hahahahahaah donno korean language russian waaaaa,0
4884,someone talk im boreddd,0
4885,dont hate get called mug piss,0
4886,miss know dont care,0
4887,cant dont option phone,0
4888,love tiddler really silly least well getting real new card like hour,0
4889,well suck,0
4890,infinite win,0
4891,are sure chorong leader cant sure anymore,0
4892,clan slot open,0
4893,pffff private finding self host header poisoning need code execution,0
4894,when connect leaf company dont alert,0
4895,cancelled ice cream uber order everyone else office got,0
4896,ahahah consider petite love hate relationship height,0
4897,cost get security alert odoo odoo partner far community spirit,0
4898,jgh im effin tired,0
4899,facebook work facebook,0
4900,no one,0
4901,no unfortunately sorry,0
4902,anyone el show box working,0
4903,ap wont anymore,0
4904,story life love london cant imagine living elsewhere gon na happen someday no space,0
4905,oh ben that terrible please provide name branch visited we would like address concern,0
4906,poor guy coasqnnaxr,0
4907,feel pain it like welsh pod,0
4908,cant wait movie come,0
4909,hi julie im sorry feel way whats happened laura,0
4910,cant im still inside train station waiting person home another hour away,0
4911,people need talk kama hawako around waa kimaaaaaani prisssss,0
4912,baggage claim the final goodbye new plane friend,0
4913,miss niamh havent seen forever,0
4914,yeah screwed time thought something good good,0
4915,hmmm always much sugar rarely make sorry couldnt help,0
4916,literally time watch paper town,0
4917,whats score im stuck work,0
4918,agh keep cutting middle,0
4919,please please come back wwe,0
4920,ill around my train delayed,0
4921,having full time job mean gon na part time fun,0
4922,my cat forgotten hate,0
4923,know long played hour,0
4924,why must the video stop tho,0
4925,wisdom teeth giving much ache,0
4926,wrist feel naked bc forgot watch bracelet,0
4927,did ligo na,0
4928,the day dozen parent and child killed baby shark for selfie coscqcni,0
4929,so heartache,0
4930,dont think,0
4931,little mix coming sweden tomorrow cant see im sad,0
4932,heart breathing moment time ill find word say leave today,0
4933,elmhurst fc ill always,0
4934,miss chillinwith,0
4935,forget job im sorry father,0
4936,istanya goingsupply extra infrastructure teacher doctor nurse paramedicsother countless thingscope,0
4937,liked video cozwovos pasha is cry after terrible donate,0
4938,im bored plea arianator talk,0
4939,lmao hahahaha slr jgh school,0
4940,my live streaming suck,0
4941,kendall kylie killing kylie snapchat,0
4942,absolute world close seeing show manila cried fucking hard time,0
4943,jeebus reabsorbtion tooth abscess threatening affect lovely front crown oooooooouch,0
4944,oh barney,0
4945,awh nice cozawczj,0
4946,sometimes be like yo follow someone day later realise theyre problematic fuck life,0
4947,they didnt expect that omg their face im so proud of you infinite,0
4948,this day mess,0
4949,miss maa didnt ever tell going like without,0
4950,why bangalore,0
4951,awww least never got called luis manzano tho,0
4952,thanks shaaaa miss super,0
4953,we didnt get the th win,0
4954,meeting convener pm looking forward,0
4955,party last night shame couldnt go would lovely seen,0
4956,no why delete,0
4957,are now in and allow the to use one of it for their,0
4958,want jack follow bad dont want annoying spamming sooo follow please,0
4959,mommy manila ive seen,0
4960,the reason im always always overweight sigeg habhab masud pa kaha ko akong un corzeutzmd convxpfzp,0
4961,yes thank oh damn hella suck least really good time thats matter,0
4962,pala omg hahaha driving lesson,0
4963,aw wan na go see dolphin cute xxx corjbaffsmbh,0
4964,holy fuck okay text need anythin,0
4965,see trend radio next sing see,0
4966,beware agonising thought experiment ahead cobttzwbkg,0
4967,last time funeral funeral modimo ho tseba wena fela feeling emotional comqysswdot,0
4968,whats wrong,0
4969,hubby delighted return home lol,0
4970,so sad for the girl oh why didnt they win,0
4971,want something new damn bill,0
4972,nowt worse sad looking willy,0
4973,sad moment gon vomit,0
4974,famous bowl,0
4975,shes cute cogrpttmxk,0
4976,devastating find last night titan ae never actually good cozzwdhdcoi,0
4977,mark followback,0
4978,omg youre beautiful miss soooooooo much,0
4979,miss much xxxxxx,0
4980,used nice hair look shiny long wavy im emo coqxxoxzq,0
4981,fun germany cant,0
4982,make tea load shedding like ha bheyps ayemso hacked cozudftknvcm,0
4983,left ear swelling,0
4984,read sm quote fb remind abt sm missing much,0
4985,everyone going womad,0
4986,wut hell cant sleep,0
4987,it vicious circle isnt,0
4988,win ticket cody simpson concert singapore august cotxkgtwtm pls pls,0
4989,sorry poooo,0
4990,sorry na bh,0
4991,project want enter may work only first chap mine phone call transcript,0
4992,bad shoulder started hurt like bitch day away competition hope itll fine time,0
4993,okay feel happens timw,0
4994,dont make acc feel bad thats rude,0
4995,suck try vitamin oil massage everyday make healthier easier stretch,0
4996,what hell going wrong dont understand people choose hurt cohibjzfcr,0
4997,dont know im since schedule whacked right,0
4998,wish could,0
4999,guy add kik thelock codnagzcphd,0
5000,valentine et al found relationship homobiphobic comment certain discipline incl european language lit education,0
5001,ghantay say light nai hay,0
5002,still wont work,0
5003,rejection reason people deny really feel,0
5004,weather ruining everything,0
5005,no laguna,0
5006,feeling sick,0
5007,exit gomen,0
5008,heck thats fair grew half inch two year,0
5009,woke feeling sick,0
5010,wish cut hair like cooytwmow,0
5011,problem im uk dont,0
5012,suuuuuuuper sick fever got way worse,0
5013,me right now cohovziwqnx,0
5014,digital sale bad feeling,0
5015,use anyones netflix account inactive wan na watch orphan black,0
5016,havent seen earlier,0
5017,yes baby kaya im sorry,0
5018,naaaaan pa goodbye stage,0
5019,music keep pausing randomly it app open,0
5020,walk inglewood ummm bad idea ugh stupid anxiety,0
5021,and easy,0
5022,this one ready week also charcoal one wont ready til mid end aug,0
5023,noooo ive heard news,0
5024,rip rodfanta,0
5025,wish better word,0
5026,yes wasp sting averted those bug mean,0
5027,can feel coghsaorm,0
5028,please dont leave,0
5029,im feel seekly,0
5030,shocking news,0
5031,cant see im sorry call manbearpig see sorry,0
5032,can grow shorter pls,0
5033,want free ice cream cobhfrbu,0
5034,exclusive germany unfair esp regarding current bleak german chart situation still entry even top pfft,0
5035,later feel place,0
5036,white washed dude polaroid effect,0
5037,feel bad talking,0
5038,love sooo much but live greece dont think im gon na win but always hope,0
5039,haha know right he need good talking xur,0
5040,dont even know whats going fill please babe xoxoxo,0
5041,raining make sure get picture soon,0
5042,want cereal too bad dont have any,0
5043,got home lost one stud earring,0
5044,miss massage,0
5045,kik guy hunde cojgbwctt,0
5046,yach telat huvvft conrzfhroja,0
5047,it been year since have been in zoo and it only on fieldtrips so no time to touch,0
5048,wanted hug watching,0
5049,missed following spree next time though,0
5050,still hoping,0
5051,awww kaya yan think positive,0
5052,miss king future bos rain corztmvkilm,0
5053,want watch movie listen sizwe eat write assignment time but cant,0
5054,time day ill result km,0
5055,four shift left heart broken,0
5056,aaaaahhhhhhhh it is only pm and feel like dying of boredom,0
5057,on birthday en,0
5058,stop playing feeling man aint got time still hoping conupmygku,0
5059,am one who dont see sinse trend something like thats,0
5060,good thing got free earring ive somehow lost one tiny screw ball thing one barbell,0
5061,owww im weekend im course next week wont able get amsterdam,0
5062,luv we havent talked looooong time,0
5063,home eye aint apartement,0
5064,with rain though,0
5065,sc longe,0
5066,especially dont like cant song,0
5067,cat lap go cownkkb,0
5068,im litro gon na weekend,0
5069,shit good shepherd lami,0
5070,thank maybe late sleep,0
5071,need relax coihfcehoxl,0
5072,nose bruised lil,0
5073,fuck snake thing journey always went never partner had beautiful scarf ate,0
5074,im hoping come back au afford go dont think ill able,0
5075,it ruin know next day wake early morning,0
5076,ill sad there nothing tonight,0
5077,want bad bitch aint got money,0
5078,cant fry chicken woe nigga,0
5079,though lighting make justice conkzasn,0
5080,that one person is still important dont want gone longer yet sit scared mind,0
5081,rly wan na buy limited ver well normal edition huhuhu choose,0
5082,stack mlady,0
5083,jk im bored acads scheduled nowwww,0
5084,couldnt watch cop james,0
5085,need clean window point today bc hugh keep pawing leaving muddy mark everywhere,0
5086,but dont know song sing,0
5087,mom called got distracted,0
5088,heyy miss,0
5089,please nice tomorrow weather otherwise picnic cancelled ive got cupcake eat colgqrwfftio,0
5090,talaga best,0
5091,female wan na get poppin joc playin,0
5092,so cute,0
5093,when saw fix you coldplay play window medium player corgnnyzcc,0
5094,think failed one subj sobrang bv pls pray huhu,0
5095,zamn line afropunk fest brooklyn,0
5096,im anymore would signed saw thank coming,0
5097,wish id put real madrid,0
5098,cutest dance ever,0
5099,oppa hug ur arm like,0
5100,asked bos raise handed ladder told climb ladder success,0
5101,get get,0
5102,nerve wracking test booset,0
5103,aw sad long though maybe little longer youd love restarted assassin creed ii heap fell love,0
5104,dont know hell playing next one find way turning,0
5105,im terrible daughter,0
5106,finally got time catch game wish could say let game begin sigh isnt working conwrirgsqv,0
5107,stepped puddle im wearing slipper,0
5108,good eve,0
5109,wake bby imy,0
5110,video sararocs angry world coegumhtok,0
5111,pretty hair,0
5112,fnaf coming holiday,0
5113,maybe tweet,0
5114,today youre,0
5115,match history,0
5116,it cant sleep,0
5117,green one ugly others awesome tho,0
5118,local legend covvltlmosq,0
5119,cant tell sad booked another cruise line could done double wail,0
5120,when thing go wrong go wrong broken manual wheelchair checked get one fit nh week wait,0
5121,poor sbenu sasin wasnt happy best player team but anarchy,0
5122,rude af im gon na put candle away,0
5123,im sure anyone would kiss ur forehead give medicine asked ur welcome,0
5124,hoya mah always good looking no comment aing,0
5125,without miss,0
5126,nobody said easy,0
5127,im sorry didnt give enough hug awhile ago tired but nice seeing luv,0
5128,aw miss,0
5129,hush gurly bring purty mouth closer that made shiver,0
5130,website doesnt solution anything paid cant even play properly,0
5131,dont know try anymore getting tired,0
5132,gol pea,0
5133,hate knowing english,0
5134,physically emotionally mentally,0
5135,my third eye getting active,0
5136,hi caroline didnt neither think figured lol,0
5137,mirror beautiful,0
5138,didnt make highlight they seem stopped talking climbing pure courage bit fishy,0
5139,didnt even anything idek,0
5140,missed apink performance,0
5141,bulet gendut,0
5142,goodbye stage,0
5143,noo know,0
5144,hug hope rest soon,0
5145,look awesome miss day racing hotwheels car around house,0
5146,typically power cut last night missed good,0
5147,ahaha im laying bed like whyyyyyy the pretty wine glass sucked,0
5148,wheres album akon,0
5149,sorry didnt update went somewhere,0
5150,the never ending nightmare still never ending,0
5151,ya ya song mino where are you,0
5152,crazyyyy thooo zz airport straight away soundcheck concert,0
5153,hmm tweet antagonistic literally sing ob song,0
5154,phantasy star online ip issuei happy could finally play game sad coduzcjyvm,0
5155,bruce wont smile couwldcqkcoq,0
5156,it morning even closed we chill cotbrjzsz,0
5157,of course dont understand yall gon na ignore question huh niqqa desperate need answer lol,0
5158,must tiny,0
5159,week mockingjay left well slow,0
5160,thing need,0
5161,not fair pb contestant dream come true time,0
5162,my cycle coming soon woe,0
5163,aarww wish could xx,0
5164,lol person want hug cant lmbo dangit miss people much cant help though,0
5165,cant sleep heck,0
5166,ohmygod worst case scenario na tooooooo,0
5167,nice weather ur fucking duck,0
5168,watching game,0
